Series_Title,Released_Year,Certificate,Runtime,Genre,IMDB_Rating,Overview,Meta_score,Director,Star1,Star2,Star3,Star4,No_of_Votes,Gross,tmdb_id,tmdb_vote_average,tmdb_release_date,tmdb_original_language,tmdb_popularity,tmdb_genres,tmdb_budget,tmdb_revenue,tmdb_runtime,tmdb_status
Dà hóng denglong gaogao guà,1991,PG,125 min,"Drama, History, Romance",8.1,"A young woman becomes the fourth wife of a wealthy lord, and must learn to live with the strict rules and tensions within the household.",,Yimou Zhang,Gong Li,Jingwu Ma,Saifei He,Cuifen Cao,29662,"2,603,061",10404,7.944,1991-12-18,zh,11.659,Drama,1000000,16600000,125,Released
Dead Poets Society,1989,U,128 min,"Comedy, Drama",8.1,Maverick teacher John Keating uses poetry to embolden his boarding school students to new heights of self-expression.,79.0,Peter Weir,Robin Williams,Robert Sean Leonard,Ethan Hawke,Josh Charles,425457,"95,860,116",207,8.31,1989-06-02,en,69.51,Drama,16400000,235900000,128,Released
Stand by Me,1986,U,89 min,"Adventure, Drama",8.1,"After the death of one of his friends, a writer recounts a childhood journey with his friends to find the body of a missing boy.",75.0,Rob Reiner,Wil Wheaton,River Phoenix,Corey Feldman,Jerry O'Connell,363401,"52,287,414",235,7.856,1986-08-08,en,28.849,"Crime, Drama",8000000,52300000,89,Released
Platoon,1986,A,120 min,"Drama, War",8.1,"Chris Taylor, a neophyte recruit in Vietnam, finds himself caught in a battle of wills between two sergeants, one good and the other evil. A shrewd examination of the brutality of war and the duality of man in conflict.",92.0,Oliver Stone,Charlie Sheen,Tom Berenger,Willem Dafoe,Keith David,381222,"138,530,565",792,7.743,1986-12-19,en,33.251,"Drama, War, Action",6000000,138530565,120,Released
"Paris, Texas",1984,U,145 min,Drama,8.1,"Travis Henderson, an aimless drifter who has been missing for four years, wanders out of the desert and must reconnect with society, himself, his life, and his family.",78.0,Wim Wenders,Harry Dean Stanton,Nastassja Kinski,Dean Stockwell,Aurore Clément,91188,"2,181,987",655,8.099,1984-07-16,en,20.28,Drama,1750000,2181987,145,Released
Kaze no tani no Naushika,1984,U,117 min,"Animation, Adventure, Fantasy",8.1,Warrior and pacifist Princess Nausicaä desperately struggles to prevent two warring nations from destroying themselves and their dying planet.,86.0,Hayao Miyazaki,Sumi Shimamoto,Mahito Tsujimura,Hisako Kyôda,Gorô Naya,150924,"495,770",81,7.939,1984-03-11,ja,22.437,"Adventure, Animation, Fantasy",1000000,3301446,117,Released
The Thing,1982,A,109 min,"Horror, Mystery, Sci-Fi",8.1,A research team in Antarctica is hunted by a shape-shifting alien that assumes the appearance of its victims.,57.0,John Carpenter,Kurt Russell,Wilford Brimley,Keith David,Richard Masur,371271,"13,782,838",1091,8.061,1982-06-25,en,51.471,"Horror, Mystery, Science Fiction",15000000,19629760,109,Released
Pink Floyd: The Wall,1982,UA,95 min,"Drama, Fantasy, Music",8.1,A confined but troubled rock star descends into madness in the midst of his physical and social isolation from everyone.,47.0,Alan Parker,Bob Geldof,Christine Hargreaves,James Laurenson,Eleanor David,76081,"22,244,207",12104,7.965,1982-07-14,en,15.833,"Music, Drama",12000000,22244207,95,Released
Fitzcarraldo,1982,R,158 min,"Adventure, Drama",8.1,"The story of Brian Sweeney Fitzgerald, an extremely determined man who intends to build an opera house in the middle of a jungle.",,Werner Herzog,Klaus Kinski,Claudia Cardinale,José Lewgoy,Miguel Ángel Fuentes,31595,,9343,7.637,1982-03-02,de,10.2,"Drama, Adventure",7362000,0,157,Released
Fanny och Alexander,1982,A,188 min,Drama,8.1,"Two young Swedish children experience the many comedies and tragedies of their family, the Ekdahls.",100.0,Ingmar Bergman,Bertil Guve,Pernilla Allwin,Kristina Adolphson,Börje Ahlstedt,57784,"4,971,340",5961,7.8,1982-12-17,sv,9.307,"Fantasy, Drama, Mystery",6000000,6800000,188,Released
Blade Runner,1982,UA,117 min,"Action, Sci-Fi, Thriller",8.1,"A blade runner must pursue and terminate four replicants who stole a ship in space, and have returned to Earth to find their creator.",84.0,Ridley Scott,Harrison Ford,Rutger Hauer,Sean Young,Edward James Olmos,693827,"32,868,943",78,7.939,1982-06-25,en,44.448,"Science Fiction, Drama, Thriller",28000000,41722424,118,Released
The Elephant Man,1980,UA,124 min,"Biography, Drama",8.1,"A Victorian surgeon rescues a heavily disfigured man who is mistreated while scraping a living as a side-show freak. Behind his monstrous façade, there is revealed a person of kindness, intelligence and sophistication.",78.0,David Lynch,Anthony Hopkins,John Hurt,Anne Bancroft,John Gielgud,220078,,1955,8.035,1980-10-09,en,34.579,"Drama, History",5000000,26000000,124,Released
Life of Brian,1979,R,94 min,Comedy,8.1,"Born on the original Christmas in the stable next door to Jesus Christ, Brian of Nazareth spends his life being mistaken for a messiah.",77.0,Terry Jones,Graham Chapman,John Cleese,Michael Palin,Terry Gilliam,367250,"20,045,115",583,7.763,1979-08-17,en,27.702,Comedy,4000000,20700000,94,Released
The Deer Hunter,1978,A,183 min,"Drama, War",8.1,An in-depth examination of the ways in which the U.S. Vietnam War impacts and disrupts the lives of people in a small industrial town in Pennsylvania.,86.0,Michael Cimino,Robert De Niro,Christopher Walken,John Cazale,John Savage,311361,"48,979,328",11778,8.006,1978-12-08,en,24.116,"Drama, War",15000000,49000000,183,Released
Rocky,1976,U,120 min,"Drama, Sport",8.1,A small-time boxer gets a supremely rare chance to fight a heavy-weight champion in a bout in which he strives to go the distance for his self-respect.,70.0,John G. Avildsen,Sylvester Stallone,Talia Shire,Burt Young,Carl Weathers,518546,"117,235,247",1366,7.79,1976-11-20,en,66.584,Drama,1000000,225300000,120,Released
Network,1976,UA,121 min,Drama,8.1,A television network cynically exploits a deranged former anchor's ravings and revelations about the news media for its own profit.,83.0,Sidney Lumet,Faye Dunaway,William Holden,Peter Finch,Robert Duvall,144911,,10774,7.82,1976-11-14,en,11.633,Drama,3800000,23700000,122,Released
Barry Lyndon,1975,PG,185 min,"Adventure, Drama, History",8.1,An Irish rogue wins the heart of a rich widow and assumes her dead husband's aristocratic position in 18th-century England.,89.0,Stanley Kubrick,Ryan O'Neal,Marisa Berenson,Patrick Magee,Hardy Krüger,149843,,3175,8.009,1975-12-18,en,22.456,"Drama, Romance, War, History",11000000,260131,185,Released
Zerkalo,1975,G,107 min,"Biography, Drama",8.1,"A dying man in his forties remembers his past. His childhood, his mother, the war, personal moments and things that tell of the recent history of all the Russian nation.",,Andrei Tarkovsky,Margarita Terekhova,Filipp Yankovskiy,Ignat Daniltsev,Oleg Yankovskiy,40081,"177,345",1396,7.977,1975-03-07,ru,22.847,"Drama, History",825370,119266,107,Released
Chinatown,1974,UA,130 min,"Drama, Mystery, Thriller",8.1,"A private detective hired to expose an adulterer finds himself caught up in a web of deceit, corruption, and murder.",92.0,Roman Polanski,Jack Nicholson,Faye Dunaway,John Huston,Perry Lopez,294230,"29,000,000",829,7.917,1974-06-20,en,26.95,"Crime, Drama, Mystery, Thriller",6000000,30000000,130,Released
Paper Moon,1973,U,102 min,"Comedy, Crime, Drama",8.1,"During the Great Depression, a con man finds himself saddled with a young girl who may or may not be his daughter, and the two forge an unlikely partnership.",77.0,Peter Bogdanovich,Ryan O'Neal,Tatum O'Neal,Madeline Kahn,John Hillerman,42285,"30,933,743",11293,7.864,1973-05-09,en,10.008,"Comedy, Crime, Drama",2500000,30900000,102,Released
Viskningar och rop,1972,A,91 min,Drama,8.1,"When a woman dying of cancer in early twentieth-century Sweden is visited by her two sisters, long-repressed feelings between the siblings rise to the surface.",,Ingmar Bergman,Harriet Andersson,Liv Ullmann,Kari Sylwan,Ingrid Thulin,30206,"1,742,348",10238,7.942,1972-12-21,sv,10.04,Drama,400000,0,95,Released
Solaris,2002,PG,167 min,"Drama, Mystery, Sci-Fi",8.1,A psychologist is sent to a station orbiting a distant planet in order to discover what has caused the crew to go insane.,90.0,Andrei Tarkovsky,Natalya Bondarchuk,Donatas Banionis,Jüri Järvet,Vladislav Dvorzhetskiy,81021,,2103,5.909,2002-11-27,en,11.105,"Drama, Science Fiction, Mystery",47000000,30002758,99,Released
Le samouraï,1967,GP,105 min,"Crime, Drama, Mystery",8.1,After professional hitman Jef Costello is seen by witnesses his efforts to provide himself an alibi drive him further into a corner.,,Jean-Pierre Melville,Alain Delon,François Périer,Nathalie Delon,Cathy Rosier,45434,"39,481",5511,7.772,1967-10-25,fr,20.701,"Crime, Thriller",0,215245,105,Released
Cool Hand Luke,1967,A,127 min,"Crime, Drama",8.1,"A laid back Southern man is sentenced to two years in a rural prison, but refuses to conform.",92.0,Stuart Rosenberg,Paul Newman,George Kennedy,Strother Martin,J.D. Cannon,161984,"16,217,773",903,7.731,1967-11-01,en,12.51,"Action, Drama, Crime",3200000,16217773,127,Released
Persona,1966,,85 min,"Drama, Thriller",8.1,A nurse is put in charge of a mute actress and finds that their personae are melding together.,86.0,Ingmar Bergman,Bibi Andersson,Liv Ullmann,Margaretha Krook,Gunnar Björnstrand,103191,,797,8.184,1966-10-18,sv,16.024,Drama,0,0,83,Released
Andrei Rublev,1966,R,205 min,"Biography, Drama, History",8.1,"The life, times and afflictions of the fifteenth-century Russian iconographer St. Andrei Rublev.",,Andrei Tarkovsky,Anatoliy Solonitsyn,Ivan Lapikov,Nikolay Grinko,Nikolay Sergeev,46947,"102,021",895,8.016,1966-12-16,ru,10.565,"Drama, History",0,24173,185,Released
La battaglia di Algeri,1966,,121 min,"Drama, War",8.1,"In the 1950s, fear and violence escalate as the people of Algiers fight for independence from the French government.",96.0,Gillo Pontecorvo,Brahim Hadjadj,Jean Martin,Yacef Saadi,Samia Kerbash,53089,"55,908",17295,7.888,1966-09-08,it,14.903,"Drama, War, History",800000,964028,121,Released
El ángel exterminador,1962,,95 min,"Drama, Fantasy",8.1,The guests at an upper-class dinner party find themselves unable to leave.,,Luis Buñuel,Silvia Pinal,Jacqueline Andere,Enrique Rambal,José Baviera,29682,,29264,8.0,1962-05-16,es,12.316,"Comedy, Drama, Fantasy",0,0,94,Released
What Ever Happened to Baby Jane?,1962,Passed,134 min,"Drama, Horror, Thriller",8.1,A former child star torments her paraplegic sister in their decaying Hollywood mansion.,75.0,Robert Aldrich,Bette Davis,Joan Crawford,Victor Buono,Wesley Addy,50058,"4,050,000",10242,7.915,1962-10-31,en,21.627,"Thriller, Drama, Horror",980000,0,135,Released
Sanjuro,1962,U,96 min,"Action, Comedy, Crime",8.1,"A crafty samurai helps a young man and his fellow clansmen save his uncle, who has been framed and imprisoned by a corrupt superintendent.",,Akira Kurosawa,Toshirô Mifune,Tatsuya Nakadai,Keiju Kobayashi,Yûnosuke Itô,33044,,11712,7.9,1962-01-01,ja,14.583,"Drama, Action, Comedy",0,0,96,Released
The Man Who Shot Liberty Valance,1962,,123 min,"Drama, Western",8.1,A senator returns to a western town for the funeral of an old friend and tells the story of his origins.,94.0,John Ford,James Stewart,John Wayne,Vera Miles,Lee Marvin,68827,,11697,7.787,1962-04-13,en,14.137,Western,3200000,8000000,123,Released
Ivanovo detstvo,1962,,95 min,"Drama, War",8.1,"In WW2, twelve year old Soviet orphan Ivan Bondarev works for the Soviet army as a scout behind the German lines and strikes a friendship with three sympathetic Soviet officers.",,Andrei Tarkovsky,Eduard Abalov,Nikolay Burlyaev,Valentin Zubkov,Evgeniy Zharikov,31728,,31442,7.9,1962-05-09,ru,7.423,"Drama, War",0,0,95,Released
Jungfrukällan,1960,A,89 min,Drama,8.1,"An innocent yet pampered young virgin and her family's pregnant and jealous servant set out to deliver candles to church, but only one returns from events that transpire in the woods along the way.",,Ingmar Bergman,Max von Sydow,Birgitta Valberg,Gunnel Lindblom,Birgitta Pettersson,26697,"1,526,000",11656,7.828,1960-02-08,sv,6.971,"Drama, History",0,700000,90,Released
Inherit the Wind,1960,Passed,128 min,"Biography, Drama, History",8.1,"Based on a real-life case in 1925, two great lawyers argue the case for and against a science teacher accused of the crime of teaching evolution.",75.0,Stanley Kramer,Spencer Tracy,Fredric March,Gene Kelly,Dick York,27254,,1908,7.702,1960-07-07,en,10.955,Drama,2000000,2000000,128,Released
Les quatre cents coups,1959,,99 min,"Crime, Drama",8.1,"A young boy, left without attention, delves into a life of petty crime.",,François Truffaut,Jean-Pierre Léaud,Albert Rémy,Claire Maurier,Guy Decomble,105291,,147,8.041,1959-06-03,fr,12.019,Drama,0,0,99,Released
Ben-Hur,1959,U,212 min,"Adventure, Drama, History",8.1,"After a Jewish prince is betrayed and sent into slavery by a Roman friend, he regains his freedom and comes back for revenge.",90.0,William Wyler,Charlton Heston,Jack Hawkins,Stephen Boyd,Haya Harareet,219466,"74,700,000",665,7.885,1959-11-18,en,54.397,"History, Drama, Adventure, Action",15000000,164000000,222,Released
Kakushi-toride no san-akunin,2002,,139 min,"Adventure, Drama",8.1,"Lured by gold, two greedy peasants unknowingly escort a princess and her general across enemy lines.",,Akira Kurosawa,Toshirô Mifune,Misa Uehara,Minoru Chiaki,Kamatari Fujiwara,34797,,523627,8.0,2002-10-25,ja,0.934,Documentary,0,0,41,Released
Le notti di Cabiria,1957,,110 min,Drama,8.1,A waifish prostitute wanders the streets of Rome looking for true love but finds only heartbreak.,,Federico Fellini,Giulietta Masina,François Périer,Franca Marzi,Dorian Gray,42940,"752,045",19426,7.992,1957-10-03,it,13.282,Drama,0,752045,110,Released
Kumonosu-jô,1957,,110 min,"Drama, History",8.1,"A war-hardened general, egged on by his ambitious wife, works to fulfill a prophecy that he would become lord of Spider's Web Castle.",,Akira Kurosawa,Toshirô Mifune,Minoru Chiaki,Isuzu Yamada,Takashi Shimura,46678,,3777,7.933,1957-01-15,ja,10.474,"Drama, History",0,13422,108,Released
The Bridge on the River Kwai,1957,PG,161 min,"Adventure, Drama, War",8.1,"British POWs are forced to build a railway bridge across the river Kwai for their Japanese captors, not knowing that the allied forces are planning to destroy it.",87.0,David Lean,William Holden,Alec Guinness,Jack Hawkins,Sessue Hayakawa,203463,"44,908,000",826,7.831,1957-10-11,en,19.244,"Drama, History, War",3000000,44908000,161,Released
On the Waterfront,1954,A,108 min,"Crime, Drama, Thriller",8.1,An ex-prize fighter turned longshoreman struggles to stand up to his corrupt union bosses.,91.0,Elia Kazan,Marlon Brando,Karl Malden,Lee J. Cobb,Rod Steiger,142107,"9,600,000",654,7.923,1954-06-22,en,11.356,"Crime, Drama, Romance",910000,960000,108,Released
Le salaire de la peur,2024,U,131 min,"Adventure, Drama, Thriller",8.1,"In a decrepit South American village, four men are hired to transport an urgent nitroglycerine shipment without the equipment that would make it safe.",85.0,Henri-Georges Clouzot,Yves Montand,Charles Vanel,Peter van Eyck,Folco Lulli,54588,,984324,6.235,2024-03-28,fr,95.394,Action,0,0,107,Released
Ace in the Hole,1951,Approved,111 min,"Drama, Film-Noir",8.1,"A frustrated former big-city journalist now stuck working for an Albuquerque newspaper exploits a story about a man trapped in a cave to rekindle his career, but the situation quickly escalates into an out-of-control circus.",72.0,Billy Wilder,Kirk Douglas,Jan Sterling,Robert Arthur,Porter Hall,31568,"3,969,893",25364,7.853,1951-06-29,en,7.568,Drama,1821052,1300000,111,Released
White Heat,1949,,114 min,"Action, Crime, Drama",8.1,A psychopathic criminal with a mother complex makes a daring break from prison and leads his old gang in a chemical plant payroll heist.,,Raoul Walsh,James Cagney,Virginia Mayo,Edmond O'Brien,Margaret Wycherly,29807,,15794,7.647,1949-09-02,en,8.985,"Crime, Drama, Thriller",1300000,3483000,114,Released
The Third Man,1949,Approved,104 min,"Film-Noir, Mystery, Thriller",8.1,"Pulp novelist Holly Martins travels to shadowy, postwar Vienna, only to find himself investigating the mysterious death of an old friend, Harry Lime.",97.0,Carol Reed,Orson Welles,Joseph Cotten,Alida Valli,Trevor Howard,158731,"449,191",1092,7.921,1949-08-31,en,17.078,"Thriller, Mystery",0,1226098,104,Released
The Red Shoes,1948,,135 min,"Drama, Music, Romance",8.1,A young ballet dancer is torn between the man she loves and her pursuit to become a prima ballerina.,,Michael Powell,Emeric Pressburger,Anton Walbrook,Marius Goring,Moira Shearer,30935,"10,900,000",19542,8.0,1948-09-06,en,12.202,"Drama, Romance",500000,0,133,Released
The Shop Around the Corner,1940,,99 min,"Comedy, Drama, Romance",8.1,"Two employees at a gift shop can barely stand each other, without realizing that they are falling in love through the post as each other's anonymous pen pal.",96.0,Ernst Lubitsch,Margaret Sullavan,James Stewart,Frank Morgan,Joseph Schildkraut,28450,"203,300",20334,8.173,1940-01-12,en,18.329,"Comedy, Drama, Romance",0,0,99,Released
Rebecca,1940,Approved,130 min,"Drama, Mystery, Romance",8.1,A self-conscious woman juggles adjusting to her new role as an aristocrat's wife and avoiding being intimidated by his first wife's spectral presence.,86.0,Alfred Hitchcock,Laurence Olivier,Joan Fontaine,George Sanders,Judith Anderson,123942,"4,360,000",223,7.895,1940-03-23,en,12.428,"Mystery, Romance, Thriller, Drama",1288000,7592465,130,Released
Mr. Smith Goes to Washington,1939,Passed,129 min,"Comedy, Drama",8.1,"A naive man is appointed to fill a vacancy in the United States Senate. His plans promptly collide with political corruption, but he doesn't back down.",73.0,Frank Capra,James Stewart,Jean Arthur,Claude Rains,Edward Arnold,107017,"9,600,000",3083,7.886,1939-10-19,en,11.221,"Comedy, Drama",1500000,9600000,129,Released
Gone with the Wind,1939,U,238 min,"Drama, History, Romance",8.1,A manipulative woman and a roguish man conduct a turbulent romance during the American Civil War and Reconstruction periods.,97.0,Victor Fleming,George Cukor,Sam Wood,Clark Gable,Vivien Leigh,290074,"198,676,459",770,7.944,1939-03-12,en,34.665,"Drama, War, Romance",4000000,402352579,233,Released
La Grande Illusion,1937,,113 min,"Drama, War",8.1,"During WWI, two French soldiers are captured and imprisoned in a German P.O.W. camp. Several escape attempts follow until they are eventually sent to a seemingly inescapable fortress.",,Jean Renoir,Jean Gabin,Dita Parlo,Pierre Fresnay,Erich von Stroheim,33829,"172,885",777,7.8,1937-06-04,fr,11.815,"Drama, History, War",0,172885,114,Released
It Happened One Night,1934,Approved,105 min,"Comedy, Romance",8.1,"A renegade reporter and a crazy young heiress meet on a bus heading for New York, and end up stuck with each other when the bus leaves them behind at one of the stops.",87.0,Frank Capra,Clark Gable,Claudette Colbert,Walter Connolly,Roscoe Karns,94016,"4,360,000",3078,7.8,1934-02-22,en,12.746,"Comedy, Romance",325000,4500000,105,Released
La passion de Jeanne d'Arc,1928,Passed,110 min,"Biography, Drama, History",8.1,"In 1431, Jeanne d'Arc is placed on trial on charges of heresy. The ecclesiastical jurists attempt to force Jeanne to recant her claims of holy visions.",,Carl Theodor Dreyer,Maria Falconetti,Eugene Silvain,André Berley,Maurice Schutz,47676,"21,877",780,8.013,1928-04-21,fr,15.379,"Drama, History",0,18121,82,Released
The Circus,1928,Passed,72 min,"Comedy, Romance",8.1,The Tramp finds work and the girl of his dreams at a circus.,90.0,Charles Chaplin,Charles Chaplin,Merna Kennedy,Al Ernest Garcia,Harry Crocker,30205,,28978,7.983,1928-01-29,en,9.823,"Comedy, Family, Romance",9000000,0,73,Released
Sunrise: A Song of Two Humans,1927,Passed,94 min,"Drama, Romance",8.1,An allegorical tale about a man fighting the good and evil within him. Both sides are made flesh - one a sophisticated woman he is attracted to and the other his wife.,,F.W. Murnau,George O'Brien,Janet Gaynor,Margaret Livingston,Bodil Rosing,46865,"539,540",631,7.843,1927-11-04,en,16.506,"Drama, Romance",0,1636000,94,Released
The General,1926,Passed,67 min,"Action, Adventure, Comedy",8.1,"When Union spies steal an engineer's beloved locomotive, he pursues it single-handedly and straight through enemy lines.",,Clyde Bruckman,Buster Keaton,Buster Keaton,Marion Mack,Glen Cavender,81156,"1,033,895",961,7.961,1926-12-25,en,16.75,"Comedy, Action, Adventure, War",750000,1000000,79,Released
Das Cabinet des Dr. Caligari,1920,,76 min,"Fantasy, Horror, Mystery",8.1,"Hypnotist Dr. Caligari uses a somnambulist, Cesare, to commit murders.",,Robert Wiene,Werner Krauss,Conrad Veidt,Friedrich Feher,Lil Dagover,57428,,234,7.928,1920-02-27,de,14.701,"Drama, Horror, Thriller, Crime",18000,8811,78,Released
Badhaai ho,2018,UA,124 min,"Comedy, Drama",8.0,A man is embarrassed when he finds out his mother is pregnant.,,Amit Ravindernath Sharma,Ayushmann Khurrana,Neena Gupta,Gajraj Rao,Sanya Malhotra,27978,,547654,7.221,2018-10-19,hi,7.579,"Comedy, Romance, Drama",4000000,39000000,125,Released
Togo,2019,U,113 min,"Adventure, Biography, Drama",8.0,"The story of Togo, the sled dog who led the 1925 serum run yet was considered by most to be too small and weak to lead such an intense race.",69.0,Ericson Core,Willem Dafoe,Julianne Nicholson,Christopher Heyerdahl,Richard Dormer,37556,,606856,8.153,2019-12-20,en,19.046,"Adventure, Family",0,0,113,Released
Airlift,2016,UA,130 min,"Drama, History",8.0,"When Iraq invades Kuwait in August 1990, a callous Indian businessman becomes the spokesperson for more than 170,000 stranded countrymen.",,Raja Menon,Akshay Kumar,Nimrat Kaur,Kumud Mishra,Prakash Belawadi,52897,,375290,7.108,2016-01-22,hi,6.327,"Drama, History, Action",4500000,32000000,126,Released
Bajrangi Bhaijaan,2015,UA,163 min,"Action, Adventure, Comedy",8.0,An Indian man with a magnanimous heart takes a young mute Pakistani girl back to her homeland to reunite her with her family.,,Kabir Khan,Salman Khan,Harshaali Malhotra,Nawazuddin Siddiqui,Kareena Kapoor,72245,"8,178,001",348892,7.812,2015-07-17,hi,8.436,"Comedy, Drama, Action",13000000,150000000,159,Released
Baby,2015,UA,159 min,"Action, Crime, Thriller",8.0,"An elite counter-intelligence unit learns of a plot, masterminded by a maniacal madman. With the clock ticking, it's up to them to track the terrorists' international tentacles and prevent them from striking at the heart of India.",,Neeraj Pandey,Akshay Kumar,Danny Denzongpa,Rana Daggubati,Taapsee Pannu,52848,,314389,6.7,2015-01-23,hi,11.571,"Action, Thriller",0,0,160,Released
La La Land,2016,A,128 min,"Comedy, Drama, Music",8.0,"While navigating their careers in Los Angeles, a pianist and an actress fall in love while attempting to reconcile their aspirations for the future.",94.0,Damien Chazelle,Ryan Gosling,Emma Stone,Rosemarie DeWitt,J.K. Simmons,505918,"151,101,803",313369,7.903,2016-11-29,en,45.692,"Comedy, Drama, Romance, Music",30000000,447407695,129,Released
Lion,2016,U,118 min,"Biography, Drama",8.0,"A five-year-old Indian boy is adopted by an Australian couple after getting lost hundreds of kilometers from home. 25 years later, he sets out to find his lost family.",69.0,Garth Davis,Dev Patel,Nicole Kidman,Rooney Mara,Sunny Pawar,213970,"51,739,495",334543,8.068,2016-11-24,en,18.747,Drama,12000000,140312928,118,Released
The Martian,2015,UA,144 min,"Adventure, Drama, Sci-Fi",8.0,"An astronaut becomes stranded on Mars after his team assume him dead, and must rely on his ingenuity to find a way to signal to Earth that he is alive.",80.0,Ridley Scott,Matt Damon,Jessica Chastain,Kristen Wiig,Kate Mara,760094,"228,433,663",286217,7.688,2015-09-30,en,52.192,"Drama, Adventure, Science Fiction",108000000,631058917,141,Released
Zootopia,2016,U,108 min,"Animation, Adventure, Comedy",8.0,"In a city of anthropomorphic animals, a rookie bunny cop and a cynical con artist fox must work together to uncover a conspiracy.",78.0,Byron Howard,Rich Moore,Jared Bush,Ginnifer Goodwin,Jason Bateman,434143,"341,268,248",269149,7.749,2016-02-11,en,87.076,"Animation, Adventure, Family, Comedy",150000000,1023784195,109,Released
Bãhubali: The Beginning,2015,UA,159 min,"Action, Drama",8.0,"In ancient India, an adventurous and daring man becomes involved in a decades-old feud between two warring peoples.",,S.S. Rajamouli,Prabhas,Rana Daggubati,Ramya Krishnan,Sathyaraj,102972,"6,738,000",256040,7.6,2015-07-10,te,16.18,"Action, Adventure, Fantasy, Drama",25130430,90747520,159,Released
Kaguyahime no monogatari,2013,U,137 min,"Animation, Adventure, Drama",8.0,"Found inside a shining stalk of bamboo by an old bamboo cutter and his wife, a tiny girl grows rapidly into an exquisite young lady. The mysterious young princess enthralls all who encounter her, but ultimately she must confront her fate, the punishment for her crime.",89.0,Isao Takahata,Chloë Grace Moretz,James Caan,Mary Steenburgen,James Marsden,38746,"1,506,975",149871,8.096,2013-11-23,ja,18.054,"Animation, Drama, Fantasy",49300000,24366656,137,Released
Wonder,2017,U,113 min,"Drama, Family",8.0,"Based on the New York Times bestseller, this movie tells the incredibly inspiring and heartwarming story of August Pullman, a boy with facial differences who enters the fifth grade, attending a mainstream elementary school for the first time.",66.0,Stephen Chbosky,Jacob Tremblay,Owen Wilson,Izabela Vidovic,Julia Roberts,141923,"132,422,809",406997,8.133,2017-11-13,en,34.756,"Drama, Family",20000000,315025930,113,Released
Gully Boy,2019,UA,154 min,"Drama, Music, Romance",8.0,A coming-of-age story based on the lives of street rappers in Mumbai.,65.0,Zoya Akhtar,Vijay Varma,Nakul Roshan Sahdev,Ranveer Singh,Vijay Raaz,31886,"5,566,534",491625,7.326,2019-02-14,hi,8.357,"Drama, Music",5782853,33974264,156,Released
