Series_Title,Released_Year,Certificate,Runtime,Genre,IMDB_Rating,Overview,Meta_score,Director,Star1,Star2,Star3,Star4,No_of_Votes,Gross,tmdb_id,tmdb_vote_average,tmdb_release_date,tmdb_original_language,tmdb_popularity,tmdb_genres,tmdb_budget,tmdb_revenue,tmdb_runtime,tmdb_status
Captain Fantastic,2016,R,118 min,"Comedy, Drama",7.9,"In the forests of the Pacific Northwest, a father devoted to raising his six kids with a rigorous physical and intellectual education is forced to leave his paradise and enter the world, challenging his idea of what it means to be a parent.",72.0,Matt Ross,Viggo Mortensen,George MacKay,Samantha Isler,Annalise Basso,189400,"5,875,006",334533,7.907,2016-07-08,en,21.208,"Adventure, Drama",5000000,23123592,118,Released
Sing Street,2016,PG-13,106 min,"Comedy, Drama, Music",7.9,A boy growing up in Dublin during the 1980s escapes his strained family life by starting a band to impress the mysterious girl he likes.,79.0,John Carney,Ferdia Walsh-Peelo,Aidan Gillen,Maria Doyle Kennedy,Jack Reynor,85109,"3,237,118",369557,7.871,2016-03-11,en,7.866,"Romance, Drama, Music",4000000,13624522,105,Released
Thor: Ragnarok,2017,UA,130 min,"Action, Adventure, Comedy",7.9,"Imprisoned on the planet Sakaar, Thor must race against time to return to Asgard and stop Ragnarök, the destruction of his world, at the hands of the powerful and ruthless villain Hela.",74.0,Taika Waititi,Chris Hemsworth,Tom Hiddleston,Cate Blanchett,Mark Ruffalo,587775,"315,058,289",284053,7.591,2017-10-02,en,55.989,"Action, Adventure, Science Fiction",180000000,855301806,131,Released
Nightcrawler,2014,A,117 min,"Crime, Drama, Thriller",7.9,"When Louis Bloom, a con man desperate for work, muscles into the world of L.A. crime journalism, he blurs the line between observer and participant to become the star of his own story.",76.0,Dan Gilroy,Jake Gyllenhaal,Rene Russo,Bill Paxton,Riz Ahmed,466134,"32,381,218",242582,7.706,2014-10-23,en,36.255,"Crime, Drama, Thriller",8500000,50300000,118,Released
Jojo Rabbit,2019,UA,108 min,"Comedy, Drama, War",7.9,A young boy in Hitler's army finds out his mother is hiding a Jewish girl in their home.,58.0,Taika Waititi,Roman Griffin Davis,Thomasin McKenzie,Scarlett Johansson,Taika Waititi,297918,"349,555",515001,8.022,2019-10-18,en,27.649,"Comedy, War, Drama",14000000,82468705,108,Released
Arrival,2016,UA,116 min,"Drama, Sci-Fi",7.9,A linguist works with the military to communicate with alien lifeforms after twelve mysterious spacecrafts appear around the world.,81.0,Denis Villeneuve,Amy Adams,Jeremy Renner,Forest Whitaker,Michael Stuhlbarg,594181,"100,546,139",329865,7.606,2016-11-10,en,51.25,"Drama, Science Fiction, Mystery",47000000,203388186,116,Released
Star Wars: Episode VII - The Force Awakens,2015,U,138 min,"Action, Adventure, Sci-Fi",7.9,"As a new threat to the galaxy rises, Rey, a desert scavenger, and Finn, an ex-stormtrooper, must join Han Solo and Chewbacca to search for the one hope of restoring peace.",80.0,J.J. Abrams,Daisy Ridley,John Boyega,Oscar Isaac,Domhnall Gleeson,860823,"936,662,225",140607,7.3,2015-12-15,en,91.317,"Adventure, Action, Science Fiction",245000000,2068223624,136,Released
Before Midnight,2013,R,109 min,"Drama, Romance",7.9,We meet Jesse and Celine nine years on in Greece. Almost two decades have passed since their first meeting on that train bound for Vienna.,94.0,Richard Linklater,Ethan Hawke,Julie Delpy,Seamus Davey-Fitzpatrick,Ariane Labed,141457,"8,114,627",132344,7.5,2013-04-05,en,17.264,"Romance, Drama",3000000,11176469,109,Released
X-Men: Days of Future Past,2014,UA,132 min,"Action, Adventure, Sci-Fi",7.9,The X-Men send Wolverine to the past in a desperate effort to change history and prevent an event that results in doom for both humans and mutants.,75.0,Bryan Singer,Patrick Stewart,Ian McKellen,Hugh Jackman,James McAvoy,659763,"233,921,534",127585,7.533,2014-05-15,en,68.109,"Action, Adventure, Science Fiction",250000000,747862775,132,Released
Bir Zamanlar Anadolu'da,2011,,157 min,"Crime, Drama",7.9,A group of men set out in search of a dead body in the Anatolian steppes.,82.0,Nuri Bilge Ceylan,Muhammet Uzuner,Yilmaz Erdogan,Taner Birsel,Ahmet Mümtaz Taylan,41995,"138,730",74879,7.498,2011-09-23,tr,12.056,"Drama, Crime",0,138730,163,Released
The Artist,2011,U,100 min,"Comedy, Drama, Romance",7.9,An egomaniacal film star develops a relationship with a young dancer against the backdrop of Hollywood's silent era.,89.0,Michel Hazanavicius,Jean Dujardin,Bérénice Bejo,John Goodman,James Cromwell,230624,"44,671,682",74643,7.453,2011-10-12,fr,10.256,"Drama, Comedy, Romance",15000000,133432856,100,Released
Edge of Tomorrow,2014,UA,113 min,"Action, Adventure, Sci-Fi",7.9,"A soldier fighting aliens gets to relive the same day over and over again, the day restarting every time he dies.",71.0,Doug Liman,Tom Cruise,Emily Blunt,Bill Paxton,Brendan Gleeson,600004,"100,206,256",137113,7.623,2014-05-27,en,62.858,"Action, Science Fiction",178000000,370541256,114,Released
Amour,2012,UA,127 min,"Drama, Romance",7.9,"Georges and Anne are an octogenarian couple. They are cultivated, retired music teachers. Their daughter, also a musician, lives in Britain with her family. One day, Anne has a stroke, and the couple's bond of love is severely tested.",94.0,Michael Haneke,Jean-Louis Trintignant,Emmanuelle Riva,Isabelle Huppert,Alexandre Tharaud,93090,"6,739,492",86837,7.77,2012-09-20,fr,12.451,"Drama, Romance",8900000,29800000,127,Released
The Irishman,2019,R,209 min,"Biography, Crime, Drama",7.9,"An old man recalls his time painting houses for his friend, Jimmy Hoffa, through the 1950-70s.",94.0,Martin Scorsese,Robert De Niro,Al Pacino,Joe Pesci,Harvey Keitel,324720,"7,000,000",398978,7.6,2019-11-01,en,28.18,"Crime, Drama, History",159000000,968853,209,Released
Un prophète,2009,A,155 min,"Crime, Drama",7.9,A young Arab man is sent to a French prison.,90.0,Jacques Audiard,Tahar Rahim,Niels Arestrup,Adel Bencherif,Reda Kateb,93560,"2,084,637",21575,7.595,2009-08-26,fr,9.34,"Crime, Drama",13000000,17874044,155,Released
Moon,2009,R,97 min,"Drama, Mystery, Sci-Fi",7.9,"Astronaut Sam Bell has a quintessentially personal encounter toward the end of his three-year stint on the Moon, where he, working alongside his computer, GERTY, sends back to Earth parcels of a resource that has helped diminish our planet's power problems.",67.0,Duncan Jones,Sam Rockwell,Kevin Spacey,Dominique McElligott,Rosie Shaw,335152,"5,009,677",17431,7.568,2009-06-12,en,27.056,"Science Fiction, Drama",5000000,9760104,97,Released
Låt den rätte komma in,2008,R,114 min,"Crime, Drama, Fantasy",7.9,"Oskar, an overlooked and bullied boy, finds love and revenge through Eli, a beautiful but peculiar girl.",82.0,Tomas Alfredson,Kåre Hedebrant,Lina Leandersson,Per Ragnar,Henrik Dahl,205609,"2,122,065",13310,7.5,2008-10-24,sv,37.16,"Horror, Drama",4000000,10785801,115,Released
District 9,2009,A,112 min,"Action, Sci-Fi, Thriller",7.9,Violence ensues after an extraterrestrial race forced to live in slum-like conditions on Earth finds a kindred spirit in a government agent exposed to their biotechnology.,81.0,Neill Blomkamp,Sharlto Copley,David James,Jason Cope,Nathalie Boltt,638202,"115,646,235",17654,7.447,2009-08-05,en,33.434,Science Fiction,30000000,210888950,112,Released
The Wrestler,2008,UA,109 min,"Drama, Sport",7.9,"A faded professional wrestler must retire, but finds his quest for a new life outside the ring a dispiriting struggle.",80.0,Darren Aronofsky,Mickey Rourke,Marisa Tomei,Evan Rachel Wood,Mark Margolis,289415,"26,236,603",12163,7.53,2008-09-07,en,14.722,"Drama, Romance",6000000,44734660,109,Released
Jab We Met,2007,U,138 min,"Comedy, Drama, Romance",7.9,A depressed wealthy businessman finds his life changing after he meets a spunky and care-free young woman.,,Imtiaz Ali,Shahid Kapoor,Kareena Kapoor,Tarun Arora,Dara Singh,47720,"410,800",11807,7.288,2007-10-26,hi,9.44,"Drama, Comedy, Romance",2300000,4600000,138,Released
Boyhood,2014,A,165 min,Drama,7.9,"The life of Mason, from early childhood to his arrival at college.",100.0,Richard Linklater,Ellar Coltrane,Patricia Arquette,Ethan Hawke,Elijah Smith,335533,"25,379,975",85350,7.503,2014-06-05,en,13.094,Drama,4000000,48137666,166,Released
"4 luni, 3 saptamâni si 2 zile",2007,,113 min,Drama,7.9,A woman assists her friend in arranging an illegal abortion in 1980s Romania.,97.0,Cristian Mungiu,Anamaria Marinca,Laura Vasiliu,Vlad Ivanov,Alexandru Potocean,56625,"1,185,783",2009,7.535,2007-08-24,ro,11.713,Drama,852510,1185783,114,Released
Star Trek,2009,UA,127 min,"Action, Adventure, Sci-Fi",7.9,The brash James T. Kirk tries to live up to his father's legacy with Mr. Spock keeping him in check as a vengeful Romulan from the future creates black holes to destroy the Federation one planet at a time.,82.0,J.J. Abrams,Chris Pine,Zachary Quinto,Simon Pegg,Leonard Nimoy,577336,"257,730,019",13475,7.429,2009-05-06,en,46.432,"Science Fiction, Action, Adventure",150000000,386839614,127,Released
In Bruges,2008,R,107 min,"Comedy, Crime, Drama",7.9,"Guilt-stricken after a job gone wrong, hitman Ray and his partner await orders from their ruthless boss in Bruges, Belgium, the last place in the world Ray wants to be.",67.0,Martin McDonagh,Colin Farrell,Brendan Gleeson,Ciarán Hinds,Elizabeth Berrington,390334,"7,757,130",8321,7.491,2008-02-08,en,18.085,"Comedy, Drama, Crime",15000000,34533783,108,Released
The Man from Earth,2007,,87 min,"Drama, Fantasy, Mystery",7.9,An impromptu goodbye party for Professor John Oldman becomes a mysterious interrogation after the retiring scholar reveals to his colleagues he has a longer and stranger past than they can imagine.,,Richard Schenkman,David Lee Smith,Tony Todd,John Billingsley,Ellen Crawford,174125,,13363,7.634,2007-06-10,en,38.142,"Science Fiction, Drama",200000,0,87,Released
Letters from Iwo Jima,2006,UA,141 min,"Action, Adventure, Drama",7.9,"The story of the battle of Iwo Jima between the United States and Imperial Japan during World War II, as told from the perspective of the Japanese who fought it.",89.0,Clint Eastwood,Ken Watanabe,Kazunari Ninomiya,Tsuyoshi Ihara,Ryô Kase,154011,"13,756,082",1251,7.473,2006-12-09,en,36.21,"Action, Drama, War",19000000,68673228,141,Released
The Fall,2006,R,117 min,"Adventure, Drama, Fantasy",7.9,"In a hospital on the outskirts of 1920s Los Angeles, an injured stuntman begins to tell a fellow patient, a little girl with a broken arm, a fantastic story of five mythical heroes. Thanks to his fractured state of mind and her vivid imagination, the line between fiction and reality blurs as the tale advances.",64.0,Tarsem Singh,Lee Pace,Catinca Untaru,Justine Waddell,Kim Uylenbroek,107290,"2,280,348",14784,7.599,2006-09-09,en,17.196,"Adventure, Fantasy, Drama",30000000,3669465,117,Released
Life of Pi,2012,U,127 min,"Adventure, Drama, Fantasy",7.9,"A young man who survives a disaster at sea is hurtled into an epic journey of adventure and discovery. While cast away, he forms an unexpected connection with another survivor: a fearsome Bengal tiger.",79.0,Ang Lee,Suraj Sharma,Irrfan Khan,Adil Hussain,Tabu,580708,"124,987,023",87827,7.4,2012-11-20,en,36.308,"Adventure, Drama",120000000,609000000,127,Released
Fantastic Mr. Fox,2009,PG,87 min,"Animation, Adventure, Comedy",7.9,An urbane fox cannot resist returning to his farm raiding ways and then must help his community survive the farmers' retaliation.,83.0,Wes Anderson,George Clooney,Meryl Streep,Bill Murray,Jason Schwartzman,199696,"21,002,919",10315,7.807,2009-10-23,en,25.889,"Adventure, Animation, Comedy, Family",40000000,46471023,87,Released
C.R.A.Z.Y.,2005,,129 min,"Comedy, Drama",7.9,"A young French-Canadian, growing up in the 1960s and 1970s, struggles to reconcile his emerging homosexuality with his father's conservative values and his own Catholic beliefs.",81.0,Jean-Marc Vallée,Michel Côté,Marc-André Grondin,Danielle Proulx,Émile Vallée,31476,,11421,7.4,2005-05-27,fr,11.616,"Comedy, Drama",0,3692417,126,Released
Les choristes,2004,PG-13,97 min,"Drama, Music",7.9,The new teacher at a severely administered boys' boarding school works to positively affect the students' lives through music.,56.0,Christophe Barratier,Gérard Jugnot,François Berléand,Jean-Baptiste Maunier,Kad Merad,57430,"3,635,164",5528,7.727,2004-03-17,fr,17.708,Drama,0,0,97,Released
Iron Man,2008,UA,126 min,"Action, Adventure, Sci-Fi",7.9,"After being held captive in an Afghan cave, billionaire engineer Tony Stark creates a unique weaponized suit of armor to fight evil.",79.0,Jon Favreau,Robert Downey Jr.,Gwyneth Paltrow,Terrence Howard,Jeff Bridges,939644,"318,412,101",1726,7.646,2008-04-30,en,94.398,"Action, Science Fiction, Adventure",140000000,585174222,126,Released
Shaun of the Dead,2004,UA,99 min,"Comedy, Horror",7.9,A man's uneventful life is disrupted by the zombie apocalypse.,76.0,Edgar Wright,Simon Pegg,Nick Frost,Kate Ashfield,Lucy Davis,512249,"13,542,874",747,7.544,2004-04-09,en,32.207,"Horror, Comedy",6000000,39396175,99,Released
Gegen die Wand,2004,R,121 min,"Drama, Romance",7.9,"With the intention to break free from the strict familial restrictions, a suicidal young woman sets up a marriage of convenience with a forty-year-old addict, an act that will lead to an outburst of envious love.",78.0,Fatih Akin,Birol Ünel,Sibel Kekilli,Güven Kiraç,Zarah Jane McKenzie,51325,,363,7.444,2004-03-11,de,7.635,"Drama, Romance",0,11030861,117,Released
Mystic River,2003,A,138 min,"Crime, Drama, Mystery",7.9,The lives of three men who were childhood friends are shattered when one of them has a family tragedy.,84.0,Clint Eastwood,Sean Penn,Tim Robbins,Kevin Bacon,Emmy Rossum,419420,"90,135,191",322,7.741,2003-10-07,en,23.493,"Thriller, Crime, Drama, Mystery",25000000,156800000,138,Released
Harry Potter and the Prisoner of Azkaban,2004,U,142 min,"Adventure, Family, Fantasy",7.9,"Harry Potter, Ron and Hermione return to Hogwarts School of Witchcraft and Wizardry for their third year of study, where they delve into the mystery surrounding an escaped prisoner who poses a dangerous threat to the young wizard.",82.0,Alfonso Cuarón,Daniel Radcliffe,Emma Watson,Rupert Grint,Richard Griffiths,552493,"249,358,727",673,8.019,2004-05-31,en,167.704,"Adventure, Fantasy",130000000,789804554,141,Released
Ying xiong,1976,PG-13,120 min,"Action, Adventure, History",7.9,"A defense officer, Nameless, was summoned by the King of Qin regarding his success of terminating three warriors.",85.0,Yimou Zhang,Jet Li,Tony Chiu-Wai Leung,Maggie Cheung,Ziyi Zhang,173999,"53,710,019",1058371,0.0,1976-05-01,zh,0.078,War,0,0,0,Released
Hable con ella,2002,R,112 min,"Drama, Mystery, Romance",7.9,Two men share an odd friendship while they care for two women who are both in deep comas.,86.0,Pedro Almodóvar,Rosario Flores,Javier Cámara,Darío Grandinetti,Leonor Watling,104691,"9,284,265",64,7.577,2002-03-15,es,8.507,"Drama, Romance",0,64803131,112,Released
No Man's Land,1987,R,98 min,"Comedy, Drama, War",7.9,"Bosnia and Herzegovina during 1993 at the time of the heaviest fighting between the two warring sides. Two soldiers from opposing sides in the conflict, Nino and Ciki, become trapped in no man's land, whilst a third soldier becomes a living booby trap.",84.0,Danis Tanovic,Branko Djuric,Rene Bitorajac,Filip Sovagovic,Georges Siatidis,44618,"1,059,830",34379,6.0,1987-10-23,en,8.585,"Action, Drama, Crime",8000000,2877571,106,Released
Cowboy Bebop: Tengoku no tobira,2001,U,115 min,"Animation, Action, Crime",7.9,"A terrorist explosion releases a deadly virus on the masses, and it's up the bounty-hunting Bebop crew to catch the cold-blooded culprit.",61.0,Shin'ichirô Watanabe,Tensai Okamura,Hiroyuki Okiura,Yoshiyuki Takei,Beau Billingslea,42897,"1,000,045",11299,7.7,2001-09-01,ja,13.234,"Action, Animation, Science Fiction",0,0,115,Released
The Bourne Identity,2002,UA,119 min,"Action, Mystery, Thriller",7.9,"A man is picked up by a fishing boat, bullet-riddled and suffering from amnesia, before racing to elude assassins and attempting to regain his memory.",68.0,Doug Liman,Franka Potente,Matt Damon,Chris Cooper,Clive Owen,508771,"121,661,683",2501,7.5,2002-06-14,en,54.556,"Action, Drama, Mystery, Thriller",60000000,214034224,119,Released
Nueve reinas,2000,R,114 min,"Crime, Drama, Thriller",7.9,"Two con artists try to swindle a stamp collector by selling him a sheet of counterfeit rare stamps (the ""nine queens"").",80.0,Fabián Bielinsky,Ricardo Darín,Gastón Pauls,Graciela Tenenbaum,María Mercedes Villagra,49721,"1,221,261",18079,7.785,2000-08-31,es,12.627,"Crime, Thriller, Drama",1300000,12413888,114,Released
Children of Men,2006,A,109 min,"Adventure, Drama, Sci-Fi",7.9,"In 2027, in a chaotic world in which women have become somehow infertile, a former activist agrees to help transport a miraculously pregnant woman to a sanctuary at sea.",84.0,Alfonso Cuarón,Julianne Moore,Clive Owen,Chiwetel Ejiofor,Michael Caine,465113,"35,552,383",9693,7.612,2006-09-22,en,18.103,"Drama, Action, Thriller, Science Fiction",76000000,70595464,109,Released
Almost Famous,2000,A,122 min,"Adventure, Comedy, Drama",7.9,A high-school boy is given the chance to write a story for Rolling Stone Magazine about an up-and-coming rock band as he accompanies them on their concert tour.,90.0,Cameron Crowe,Billy Crudup,Patrick Fugit,Kate Hudson,Frances McDormand,252586,"32,534,850",786,7.508,2000-09-15,en,17.423,"Drama, Music",60000000,47386287,124,Released
Mulholland Dr.,1999,R,147 min,"Drama, Mystery, Thriller",7.9,"After a car wreck on the winding Mulholland Drive renders a woman amnesiac, she and a perky Hollywood-hopeful search for clues and answers across Los Angeles in a twisting venture beyond dreams and reality.",85.0,David Lynch,Naomi Watts,Laura Harring,Justin Theroux,Jeanne Bates,322031,"7,220,243",185789,7.843,1999-01-01,en,8.025,"Thriller, TV Movie, Drama, Mystery",0,0,88,Released
Toy Story 2,1999,U,92 min,"Animation, Adventure, Comedy",7.9,"When Woody is stolen by a toy collector, Buzz and his friends set out on a rescue mission to save Woody before he becomes a museum toy property with his roundup gang Jessie, Prospector, and Bullseye.",88.0,John Lasseter,Ash Brannon,Lee Unkrich,Tom Hanks,Tim Allen,527512,"245,852,179",863,7.598,1999-10-30,en,75.191,"Animation, Comedy, Family",90000000,497375381,92,Released
Boogie Nights,1997,R,155 min,Drama,7.9,"Back when sex was safe, pleasure was a business and business was booming, an idealistic porn producer aspires to elevate his craft to an art when he discovers a hot young talent.",85.0,Paul Thomas Anderson,Mark Wahlberg,Julianne Moore,Burt Reynolds,Luis Guzmán,239473,"26,400,640",4995,7.642,1997-10-10,en,19.367,Drama,15000000,43101594,156,Released
Mimi wo sumaseba,2022,U,111 min,"Animation, Drama, Family",7.9,"A love story between a girl who loves reading books, and a boy who has previously checked out all of the library books she chooses.",75.0,Yoshifumi Kondô,Yoko Honna,Issey Takahashi,Takashi Tachibana,Shigeru Muroi,51943,,700145,6.1,2022-10-14,ja,1.595,"Drama, Family",0,0,114,Released
Once Were Warriors,1994,A,102 min,"Crime, Drama",7.9,A family descended from Maori warriors is bedeviled by a violent father and the societal problems of being treated as outcasts.,77.0,Lee Tamahori,Rena Owen,Temuera Morrison,Mamaengaroa Kerr-Bell,Julian Arahanga,31590,"2,201,126",527,7.4,1994-09-02,en,14.526,Drama,950000,6700000,99,Released
True Romance,1993,R,119 min,"Crime, Drama, Romance",7.9,"In Detroit, a lonely pop culture geek marries a call girl, steals cocaine from her pimp, and tries to sell it in Hollywood. Meanwhile, the owners of the cocaine, the Mob, track them down in an attempt to reclaim it.",59.0,Tony Scott,Christian Slater,Patricia Arquette,Dennis Hopper,Val Kilmer,206918,"12,281,500",319,7.5,1993-09-09,en,17.054,"Action, Crime, Romance",12500000,12600000,118,Released
Trois couleurs: Bleu,1993,U,94 min,"Drama, Music, Mystery",7.9,A woman struggles to find a way to live her life after the death of her husband and child.,85.0,Krzysztof Kieslowski,Juliette Binoche,Zbigniew Zamachowski,Julie Delpy,Benoît Régent,89836,"1,324,974",108,7.653,1993-09-08,fr,17.879,Drama,0,0,98,Released
Jûbê ninpûchô,1993,A,94 min,"Animation, Action, Adventure",7.9,A vagabond swordsman is aided by a beautiful ninja girl and a crafty spy in confronting a demonic clan of killers - with a ghost from his past as their leader - who are bent on overthrowing the Tokugawa Shogunate.,,Yoshiaki Kawajiri,Kôichi Yamadera,Emi Shinohara,Takeshi Aono,Osamu Saka,34529,,14282,7.745,1993-06-05,ja,16.673,"Fantasy, Adventure, Animation, Action",60000000,0,94,Released
Carlito's Way,1993,A,144 min,"Crime, Drama, Thriller",7.9,"A Puerto Rican former convict, just released from prison, pledges to stay away from drugs and violence despite the pressure around him and lead on to a better life outside of N.Y.C.",65.0,Brian De Palma,Al Pacino,Sean Penn,Penelope Ann Miller,John Leguizamo,201000,"36,948,322",6075,7.8,1993-11-10,en,18.588,"Crime, Drama, Thriller",30000000,63800000,144,Released
Edward Scissorhands,1990,U,105 min,"Drama, Fantasy, Romance",7.9,"An artificial man, who was incompletely constructed and has scissors for hands, leads a solitary life. Then one day, a suburban lady meets him and introduces him to her world.",74.0,Tim Burton,Johnny Depp,Winona Ryder,Dianne Wiest,Anthony Michael Hall,447368,"56,362,352",162,7.7,1990-12-07,en,72.837,"Fantasy, Drama, Romance",20000000,86024005,105,Released
My Left Foot: The Story of Christy Brown,1989,U,103 min,"Biography, Drama",7.9,"Christy Brown, born with cerebral palsy, learns to paint and write with his only controllable limb - his left foot.",97.0,Jim Sheridan,Daniel Day-Lewis,Brenda Fricker,Alison Whelan,Kirsten Sheridan,68076,"14,743,391",10161,7.5,1989-04-07,en,15.376,Drama,645180,14743391,103,Released
Crimes and Misdemeanors,1989,PG-13,104 min,"Comedy, Drama",7.9,An ophthalmologist's mistress threatens to reveal their affair to his wife while a married documentary filmmaker is infatuated with another woman.,77.0,Woody Allen,Martin Landau,Woody Allen,Bill Bernstein,Claire Bloom,54670,"18,254,702",11562,7.4,1989-10-13,en,9.857,"Comedy, Drama, Crime",19000000,18254702,104,Released
The Untouchables,1987,A,119 min,"Crime, Drama, Thriller",7.9,"During the era of Prohibition in the United States, Federal Agent Eliot Ness sets out to stop ruthless Chicago gangster Al Capone and, because of rampant corruption, assembles a small, hand-picked team to help him.",79.0,Brian De Palma,Kevin Costner,Sean Connery,Robert De Niro,Charles Martin Smith,281842,"76,270,454",117,7.767,1987-06-03,en,27.101,"Crime, History, Thriller",25000000,76270454,119,Released
Hannah and Her Sisters,1986,PG-13,107 min,"Comedy, Drama",7.9,"Between two Thanksgivings two years apart, Hannah's husband falls in love with her sister Lee, while her hypochondriac ex-husband rekindles his relationship with her sister Holly.",90.0,Woody Allen,Mia Farrow,Dianne Wiest,Michael Caine,Barbara Hershey,67176,"40,084,041",5143,7.512,1986-02-07,en,11.497,"Comedy, Drama",6400000,40084041,107,Released
Brazil,1985,U,132 min,"Drama, Sci-Fi",7.9,A bureaucrat in a dystopic society becomes an enemy of the state as he pursues the woman of his dreams.,84.0,Terry Gilliam,Jonathan Pryce,Kim Greist,Robert De Niro,Katherine Helmond,187567,"9,929,135",68,7.673,1985-02-20,en,12.864,"Comedy, Science Fiction",15000000,9900000,143,Released
This Is Spinal Tap,1984,R,82 min,"Comedy, Music",7.9,"Spinal Tap, one of England's loudest bands, is chronicled by film director Marty DiBergi on what proves to be a fateful tour.",92.0,Rob Reiner,Rob Reiner,Michael McKean,Christopher Guest,Kimberly Stringer,128812,"188,751",11031,7.422,1984-03-02,en,14.2,"Music, Comedy",2500000,4737539,82,Released
A Christmas Story,1983,U,93 min,"Comedy, Family",7.9,"In the 1940s, a young boy named Ralphie attempts to convince his parents, his teacher and Santa that a Red Ryder BB gun really is the perfect Christmas gift.",77.0,Bob Clark,Peter Billingsley,Melinda Dillon,Darren McGavin,Scott Schwartz,132947,"20,605,209",850,7.257,1983-11-18,en,16.355,"Comedy, Family",3300000,20700000,93,Released
The Blues Brothers,1980,U,133 min,"Action, Adventure, Comedy",7.9,"Jake Blues, just released from prison, puts together his old band to save the Catholic home where he and his brother Elwood were raised.",60.0,John Landis,John Belushi,Dan Aykroyd,Cab Calloway,John Candy,183182,"57,229,890",525,7.734,1980-06-16,en,19.255,"Music, Comedy, Action, Crime",27000000,115200000,133,Released
Manhattan,1979,R,96 min,"Comedy, Drama, Romance",7.9,The life of a divorced television writer dating a teenage girl is further complicated when he falls in love with his best friend's mistress.,83.0,Woody Allen,Woody Allen,Diane Keaton,Mariel Hemingway,Michael Murphy,131436,"45,700,000",696,7.727,1979-04-25,en,13.873,"Comedy, Drama, Romance",9000000,40194067,96,Released
All That Jazz,1979,A,123 min,"Drama, Music, Musical",7.9,"Director/choreographer Bob Fosse tells his own life story as he details the sordid career of Joe Gideon, a womanizing, drug-using dancer.",72.0,Bob Fosse,Roy Scheider,Jessica Lange,Ann Reinking,Leland Palmer,28223,"37,823,676",16858,7.452,1979-12-16,en,9.876,Drama,12000000,37823676,123,Released
Dawn of the Dead,2004,A,127 min,"Action, Adventure, Horror",7.9,"Following an ever-growing epidemic of zombies that have risen from the dead, two Philadelphia S.W.A.T. team members, a traffic reporter, and his television executive girlfriend seek refuge in a secluded shopping mall.",71.0,George A. Romero,David Emge,Ken Foree,Scott H. Reiniger,Gaylen Ross,111512,"5,100,000",924,7.058,2004-03-19,en,32.365,"Action, Horror, Drama, Science Fiction",26000000,102278712,101,Released
