Series_Title,Released_Year,Certificate,Runtime,Genre,IMDB_Rating,Overview,Meta_score,Director,Star1,Star2,Star3,Star4,No_of_Votes,Gross,tmdb_id,tmdb_vote_average,tmdb_release_date,tmdb_original_language,tmdb_popularity,tmdb_genres,tmdb_budget,tmdb_revenue,tmdb_runtime,tmdb_status
Boyz n the Hood,1991,A,112 min,"Crime, Drama",7.8,"Follows the lives of three young males living in the Crenshaw ghetto of Los Angeles, dissecting questions of race, relationships, violence, and future prospects.",76.0,John Singleton,Cuba Gooding Jr.,Laurence Fishburne,Hudhail Al-Amir,Lloyd Avery II,126082,"57,504,069",650,7.6,1991-07-12,en,21.927,"Crime, Drama",6500000,57504069,112,Released
Misery,1990,R,107 min,"Drama, Thriller",7.8,"After a famous author is rescued from a car crash by a fan of his novels, he comes to realize that the care he is receiving is only the beginning of a nightmare of captivity and abuse.",75.0,Rob Reiner,James Caan,Kathy Bates,Richard Farnsworth,Frances Sternhagen,184740,"61,276,872",1700,7.763,1990-11-30,en,23.388,"Drama, Thriller",20000000,61300000,107,Released
Awakenings,1990,U,121 min,"Biography, Drama",7.8,"The victims of an encephalitis epidemic many years ago have been catatonic ever since, but now a new drug offers the prospect of reviving them.",74.0,Penny Marshall,Robert De Niro,Robin Williams,Julie Kavner,Ruth Nelson,125276,"52,096,475",11005,7.769,1990-12-04,en,14.548,Drama,31000000,52096475,120,Released
Majo no takkyûbin,2014,U,103 min,"Animation, Adventure, Drama",7.8,"A young witch, on her mandatory year of independent life, finds fitting into a new community difficult while she supports herself by running an air courier service.",83.0,Hayao Miyazaki,Kirsten Dunst,Minami Takayama,Rei Sakuma,Kappei Yamaguchi,124193,,252391,6.03,2014-03-01,ja,9.671,"Fantasy, Adventure, Comedy",0,0,108,Released
Glory,1989,R,122 min,"Biography, Drama, History",7.8,"Robert Gould Shaw leads the U.S. Civil War's first all-black volunteer company, fighting prejudices from both his own Union Army, and the Confederates.",78.0,Edward Zwick,Matthew Broderick,Denzel Washington,Cary Elwes,Morgan Freeman,122779,"26,830,000",9665,7.469,1989-12-15,en,16.764,"Drama, History, War",18000000,26800000,122,Released
Dip huet seung hung,1989,R,111 min,"Action, Crime, Drama",7.8,A disillusioned assassin accepts one last hit in hopes of using his earnings to restore vision to a singer he accidentally blinded.,82.0,John Woo,Yun-Fat Chow,Danny Lee,Sally Yeh,Kong Chu,45624,,10835,7.606,1989-03-24,cn,14.454,"Action, Crime, Drama, Thriller",0,2350174,110,Released
Back to the Future Part II,1989,U,108 min,"Adventure, Comedy, Sci-Fi",7.8,"After visiting 2015, Marty McFly must repeat his visit to 1955 to prevent disastrous changes to 1985...without interfering with his first trip.",57.0,Robert Zemeckis,Michael J. Fox,Christopher Lloyd,Lea Thompson,Thomas F. Wilson,481918,"118,500,000",165,7.764,1989-11-22,en,35.547,"Adventure, Comedy, Science Fiction",40000000,332000000,108,Released
Mississippi Burning,1988,A,128 min,"Crime, Drama, History",7.8,Two F.B.I. Agents with wildly different styles arrive in Mississippi to investigate the disappearance of some civil rights activists.,65.0,Alan Parker,Gene Hackman,Willem Dafoe,Frances McDormand,Brad Dourif,88214,"34,603,943",1632,7.673,1988-12-08,en,15.677,"Drama, Crime",15000000,34604000,128,Released
Predator,1987,A,107 min,"Action, Adventure, Sci-Fi",7.8,A team of commandos on a mission in a Central American jungle find themselves hunted by an extraterrestrial warrior.,45.0,John McTiernan,Arnold Schwarzenegger,Carl Weathers,Kevin Peter Hall,Elpidia Carrillo,371387,"59,735,548",106,7.533,1987-06-12,en,69.717,"Science Fiction, Action, Adventure, Thriller",15000000,98267558,107,Released
Evil Dead II,1987,A,84 min,"Action, Comedy, Fantasy",7.8,The lone survivor of an onslaught of flesh-possessing spirits holes up in a cabin with a group of strangers while the demons continue their attack.,72.0,Sam Raimi,Bruce Campbell,Sarah Berry,Dan Hicks,Kassie Wesley DePaiva,148359,"5,923,044",765,7.557,1987-03-13,en,26.198,"Horror, Comedy, Fantasy",3500000,10900000,84,Released
Ferris Bueller's Day Off,1986,U,103 min,Comedy,7.8,"A high school wise guy is determined to have a day off from school, despite what the Principal thinks of that.",61.0,John Hughes,Matthew Broderick,Alan Ruck,Mia Sara,Jeffrey Jones,321382,"70,136,369",9377,7.584,1986-06-11,en,21.953,Comedy,6000000,70100000,103,Released
Down by Law,1986,R,107 min,"Comedy, Crime, Drama",7.8,"Two men are framed and sent to jail, where they meet a murderer who helps them escape and leave the state.",75.0,Jim Jarmusch,Tom Waits,John Lurie,Roberto Benigni,Nicoletta Braschi,47834,"1,436,000",1554,7.352,1986-09-20,en,10.078,"Crime, Drama, Comedy",0,0,106,Released
The Goonies,1985,U,114 min,"Adventure, Comedy, Family",7.8,A group of young misfits called The Goonies discover an ancient map and set out on an adventure to find a legendary pirate's long-lost treasure.,62.0,Richard Donner,Sean Astin,Josh Brolin,Jeff Cohen,Corey Feldman,244430,"61,503,218",9340,7.516,1985-06-07,en,43.197,"Adventure, Comedy, Family",19000000,61389680,114,Released
The Color Purple,2023,U,154 min,Drama,7.8,A black Southern woman struggles to find her identity after suffering abuse from her father and others over four decades.,78.0,Steven Spielberg,Danny Glover,Whoopi Goldberg,Oprah Winfrey,Margaret Avery,78321,"98,467,863",558915,7.089,2023-12-25,en,15.286,Drama,95000000,67519192,141,Released
The Breakfast Club,1985,UA,97 min,"Comedy, Drama",7.8,Five high school students meet in Saturday detention and discover how they have a lot more in common than they thought.,66.0,John Hughes,Emilio Estevez,Judd Nelson,Molly Ringwald,Ally Sheedy,357026,"45,875,171",2108,7.743,1985-02-15,en,18.358,"Comedy, Drama",1000000,51525171,98,Released
The Killing Fields,1984,UA,141 min,"Biography, Drama, History",7.8,"A journalist is trapped in Cambodia during tyrant Pol Pot's bloody 'Year Zero' cleansing campaign, which claimed the lives of two million 'undesirable' civilians.",76.0,Roland Joffé,Sam Waterston,Haing S. Ngor,John Malkovich,Julian Sands,51585,"34,700,291",625,7.5,1984-11-23,en,14.343,"Drama, History, War",14400000,34700291,142,Released
Ghostbusters,1984,UA,105 min,"Action, Comedy, Fantasy",7.8,Three former parapsychology professors set up shop as a unique ghost removal service.,71.0,Ivan Reitman,Bill Murray,Dan Aykroyd,Sigourney Weaver,Harold Ramis,355413,"238,632,124",620,7.5,1984-06-08,en,32.708,"Comedy, Fantasy",30000000,296578797,107,Released
The Right Stuff,1983,PG,193 min,"Adventure, Biography, Drama",7.8,"The story of the original Mercury 7 astronauts and their macho, seat-of-the-pants approach to the space program.",91.0,Philip Kaufman,Sam Shepard,Scott Glenn,Ed Harris,Dennis Quaid,56235,"21,500,000",9549,7.4,1983-10-20,en,13.436,"Drama, History, Adventure",27000000,21500000,193,Released
The King of Comedy,1982,U,109 min,"Comedy, Crime, Drama",7.8,"Rupert Pupkin is a passionate yet unsuccessful comic who craves nothing more than to be in the spotlight and to achieve this, he stalks and kidnaps his idol to take the spotlight for himself.",73.0,Martin Scorsese,Robert De Niro,Jerry Lewis,Diahnne Abbott,Sandra Bernhard,88511,"2,500,000",262,7.791,1982-12-18,en,19.043,"Drama, Comedy",19000000,2536000,109,Released
E.T. the Extra-Terrestrial,1982,U,115 min,"Family, Sci-Fi",7.8,A troubled child summons the courage to help a friendly alien escape Earth and return to his home world.,91.0,Steven Spielberg,Henry Thomas,Drew Barrymore,Peter Coyote,Dee Wallace,372490,"435,110,554",601,7.519,1982-06-11,en,34.85,"Science Fiction, Adventure, Family, Fantasy",10500000,792965500,115,Released
Kramer vs. Kramer,1979,A,105 min,Drama,7.8,"Ted Kramer's wife leaves him, allowing for a lost bond to be rediscovered between Ted and his son, Billy. But a heated custody battle ensues over the divorced couple's son, deepening the wounds left by the separation.",77.0,Robert Benton,Dustin Hoffman,Meryl Streep,Jane Alexander,Justin Henry,133351,"106,260,000",12102,7.572,1979-12-07,en,12.698,Drama,8000000,106260000,105,Released
Days of Heaven,1978,PG,94 min,"Drama, Romance",7.8,A hot-tempered farm laborer convinces the woman he loves to marry their rich but dying boss so that they can have a claim to his fortune.,93.0,Terrence Malick,Richard Gere,Brooke Adams,Sam Shepard,Linda Manz,52852,,16642,7.505,1978-09-13,en,13.3,"Drama, Romance",3000000,3700000,94,Released
The Outlaw Josey Wales,1976,A,135 min,Western,7.8,Missouri farmer Josey Wales joins a Confederate guerrilla unit and winds up on the run from the Union soldiers who murdered his family.,69.0,Clint Eastwood,Clint Eastwood,Sondra Locke,Chief Dan George,Bill McKinney,65659,"31,800,000",10747,7.416,1976-06-30,en,24.238,Western,3700000,31800000,135,Released
The Man Who Would Be King,1975,PG,129 min,"Adventure, History, War",7.8,"Two British former soldiers decide to set themselves up as Kings in Kafiristan, a land where no white man has set foot since Alexander the Great.",91.0,John Huston,Sean Connery,Michael Caine,Christopher Plummer,Saeed Jaffrey,44917,,983,7.495,1975-12-03,en,7.343,"Adventure, Drama",8000000,12678,129,Released
The Conversation,1974,U,113 min,"Drama, Mystery, Thriller",7.8,"A paranoid, secretive surveillance expert has a crisis of conscience when he suspects that the couple he is spying on will be murdered.",85.0,Francis Ford Coppola,Gene Hackman,John Cazale,Allen Garfield,Frederic Forrest,98611,"4,420,000",592,7.527,1974-04-07,en,15.513,"Crime, Drama, Mystery",1600000,4794457,114,Released
La planète sauvage,1973,U,72 min,"Animation, Sci-Fi",7.8,"On a faraway planet where blue giants rule, oppressed humanoids rebel against their machine-like leaders.",73.0,René Laloux,Barry Bostwick,Jennifer Drake,Eric Baugin,Jean Topart,25229,"193,817",16306,7.654,1973-12-01,fr,12.656,"Animation, Science Fiction",0,0,72,Released
The Day of the Jackal,1973,A,143 min,"Crime, Drama, Thriller",7.8,"A professional assassin codenamed ""Jackal"" plots to kill Charles de Gaulle, the President of France.",80.0,Fred Zinnemann,Edward Fox,Terence Alexander,Michel Auclair,Alan Badel,37445,"16,056,255",4909,7.5,1973-05-16,en,18.761,"Action, Thriller",0,16056255,143,Released
Badlands,1974,PG,94 min,"Action, Crime, Drama",7.8,An impressionable teenage girl from a dead-end town and her older greaser boyfriend embark on a killing spree in the South Dakota badlands.,93.0,Terrence Malick,Martin Sheen,Sissy Spacek,Warren Oates,Ramon Bieri,66009,,3133,7.506,1974-01-05,en,10.483,"Crime, Drama, Romance",300000,0,94,Released
Cabaret,1972,A,124 min,"Drama, Music, Musical",7.8,A female girlie club entertainer in Weimar Republic era Berlin romances two men while the Nazi Party rises to power around them.,80.0,Bob Fosse,Liza Minnelli,Michael York,Helmut Griem,Joel Grey,48334,"42,765,000",10784,7.401,1972-02-13,en,9.096,"Music, Drama, Romance",4600000,42800000,124,Released
Willy Wonka & the Chocolate Factory,1971,U,100 min,"Family, Fantasy, Musical",7.8,A poor but hopeful boy seeks one of the five coveted golden tickets that will send him on a tour of Willy Wonka's mysterious chocolate factory.,67.0,Mel Stuart,Gene Wilder,Jack Albertson,Peter Ostrum,Roy Kinnear,178731,"4,000,000",252,7.494,1971-06-29,en,38.42,"Family, Fantasy, Comedy",3000000,4000000,99,Released
Midnight Cowboy,1969,A,113 min,Drama,7.8,"A naive hustler travels from Texas to New York City to seek personal fortune, finding a new friend in the process.",79.0,John Schlesinger,Dustin Hoffman,Jon Voight,Sylvia Miles,John McGiver,101124,"44,785,053",3116,7.516,1969-05-25,en,16.099,Drama,3600000,44785053,113,Released
Wait Until Dark,1967,,108 min,Thriller,7.8,A recently blinded woman is terrorized by a trio of thugs while they search for a heroin-stuffed doll they believe is in her apartment.,81.0,Terence Young,Audrey Hepburn,Alan Arkin,Richard Crenna,Efrem Zimbalist Jr.,27733,"17,550,741",11206,7.347,1967-10-26,en,13.136,"Thriller, Horror",4000000,11000000,108,Released
Guess Who's Coming to Dinner,1967,,108 min,"Comedy, Drama",7.8,A couple's attitudes are challenged when their daughter introduces them to her African-American fiancé.,63.0,Stanley Kramer,Spencer Tracy,Sidney Poitier,Katharine Hepburn,Katharine Houghton,39642,"56,700,000",1879,7.558,1967-12-11,en,13.942,"Drama, Romance",4000000,56666667,108,Released
Bonnie and Clyde,1967,A,111 min,"Action, Biography, Crime",7.8,"Bored waitress Bonnie Parker falls in love with an ex-con named Clyde Barrow and together they start a violent crime spree through the country, stealing cars and robbing banks.",86.0,Arthur Penn,Warren Beatty,Faye Dunaway,Michael J. Pollard,Gene Hackman,102415,,475,7.5,1967-08-14,en,18.26,"Crime, Drama",2500000,50700000,111,Released
My Fair Lady,1964,U,170 min,"Drama, Family, Musical",7.8,Snobbish phonetics Professor Henry Higgins agrees to a wager that he can make flower girl Eliza Doolittle presentable in high society.,95.0,George Cukor,Audrey Hepburn,Rex Harrison,Stanley Holloway,Wilfrid Hyde-White,86525,"72,000,000",11113,7.51,1964-10-21,en,16.91,"Music, Comedy, Romance, Drama",17000000,72661442,170,Released
Mary Poppins,1964,U,139 min,"Comedy, Family, Fantasy",7.8,"In turn of the century London, a magical nanny employs music and adventure to help two neglected children become closer to their father.",88.0,Robert Stevenson,Julie Andrews,Dick Van Dyke,David Tomlinson,Glynis Johns,158029,"102,272,727",433,7.578,1964-12-17,en,23.466,"Comedy, Family, Fantasy",4650000,103100000,139,Released
The Longest Day,1962,G,178 min,"Action, Drama, History",7.8,"The events of D-Day, told on a grand scale from both the Allied and German points of view.",75.0,Ken Annakin,Andrew Marton,Gerd Oswald,Bernhard Wicki,Darryl F. Zanuck,52141,"39,100,000",9289,7.6,1962-09-25,en,20.545,"War, Action, Drama",10000000,50100000,178,Released
Jules et Jim,1962,,105 min,"Drama, Romance",7.8,Decades of a love triangle concerning two friends and an impulsive woman.,97.0,François Truffaut,Jeanne Moreau,Oskar Werner,Henri Serre,Vanna Urbino,37605,,1628,7.6,1962-01-23,fr,8.241,"Drama, Romance",0,0,106,Released
The Innocents,1961,A,100 min,Horror,7.8,A young governess for two children becomes convinced that the house and grounds are haunted.,88.0,Jack Clayton,Deborah Kerr,Peter Wyngarde,Megs Jenkins,Michael Redgrave,27007,"2,616,000",16372,7.4,1961-12-15,en,9.679,"Horror, Mystery",0,1200000,100,Released
À bout de souffle,1960,U,90 min,"Crime, Drama",7.8,"A small-time thief steals a car and impulsively murders a motorcycle policeman. Wanted by the authorities, he reunites with a hip American journalism student and attempts to persuade her to run away with him to Italy.",,Jean-Luc Godard,Jean-Paul Belmondo,Jean Seberg,Daniel Boulanger,Henri-Jacques Huet,73251,"336,705",269,7.531,1960-03-16,fr,14.566,"Drama, Crime",0,0,90,Released
Red River,1948,Passed,133 min,"Action, Adventure, Drama",7.8,"Dunson leads a cattle drive, the culmination of over 14 years of work, to its destination in Missouri. But his tyrannical behavior along the way causes a mutiny, led by his adopted son.",,Howard Hawks,Arthur Rosson,John Wayne,Montgomery Clift,Joanne Dru,28167,,3089,7.371,1948-08-26,en,8.717,Western,3000000,9012000,133,Released
Key Largo,1948,,100 min,"Action, Crime, Drama",7.8,"A man visits his war buddy's family hotel and finds a gangster running things. As a hurricane approaches, the two end up confronting each other.",,John Huston,Humphrey Bogart,Edward G. Robinson,Lauren Bacall,Lionel Barrymore,36995,,11016,7.483,1948-07-16,en,8.412,"Crime, Thriller",0,0,100,Released
To Have and Have Not,1945,PG,100 min,"Adventure, Comedy, Film-Noir",7.8,"During World War II, American expatriate Harry Morgan helps transport a French Resistance leader and his beautiful wife to Martinique while romancing a sensuous lounge singer.",,Howard Hawks,Humphrey Bogart,Lauren Bacall,Walter Brennan,Dolores Moran,31053,,22584,7.463,1945-01-20,en,9.144,"Adventure, Romance, War",0,3650000,100,Released
Shadow of a Doubt,1943,PG,108 min,"Film-Noir, Thriller",7.8,"A young girl, overjoyed when her favorite uncle comes to visit the family, slowly begins to suspect that he is in fact the ""Merry Widow"" killer sought by the authorities.",94.0,Alfred Hitchcock,Teresa Wright,Joseph Cotten,Macdonald Carey,Henry Travers,59556,,21734,7.512,1943-01-15,en,12.732,Thriller,0,0,108,Released
Stagecoach,1966,Passed,96 min,"Adventure, Drama, Western",7.8,A group of people traveling on a stagecoach find their journey complicated by the threat of Geronimo and learn something about each other in the process.,93.0,John Ford,John Wayne,Claire Trevor,Andy Devine,John Carradine,43621,,39287,6.037,1966-04-21,en,8.279,Western,0,0,115,Released
The Lady Vanishes,1979,,96 min,"Mystery, Thriller",7.8,"While travelling in continental Europe, a rich young playgirl realizes that an elderly lady seems to have disappeared from the train.",98.0,Alfred Hitchcock,Margaret Lockwood,Michael Redgrave,Paul Lukas,May Whitty,47400,,4706,6.041,1979-04-30,en,5.161,"Mystery, Thriller, Comedy, Romance",0,0,97,Released
Bringing Up Baby,1938,Passed,102 min,"Comedy, Family, Romance",7.8,"While trying to secure a $1 million donation for his museum, a befuddled paleontologist is pursued by a flighty and often irritating heiress and her pet leopard, Baby.",91.0,Howard Hawks,Katharine Hepburn,Cary Grant,Charles Ruggles,Walter Catlett,55163,,900,7.5,1938-02-18,en,9.187,"Comedy, Romance",1073000,0,102,Released
Bride of Frankenstein,1935,,75 min,"Drama, Horror, Sci-Fi",7.8,"Mary Shelley reveals the main characters of her novel survived: Dr. Frankenstein, goaded by an even madder scientist, builds his monster a mate.",95.0,James Whale,Boris Karloff,Elsa Lanchester,Colin Clive,Valerie Hobson,43542,"4,360,000",229,7.488,1935-04-20,en,16.254,"Horror, Science Fiction",393750,2000000,75,Released
Duck Soup,1933,,69 min,"Comedy, Musical, War",7.8,Rufus T. Firefly is named president/dictator of bankrupt Freedonia and declares war on neighboring Sylvania over the love of wealthy Mrs. Teasdale.,93.0,Leo McCarey,Groucho Marx,Harpo Marx,Chico Marx,Zeppo Marx,55581,,3063,7.3,1933-11-12,en,7.367,"Comedy, War",0,0,69,Released
Scarface: The Shame of the Nation,1932,PG,93 min,"Action, Crime, Drama",7.8,"An ambitious and nearly insane violent gangster climbs the ladder of success in the mob, but his weaknesses prove to be his downfall.",87.0,Howard Hawks,Richard Rosson,Paul Muni,Ann Dvorak,Karen Morley,25312,,877,7.5,1932-04-09,en,18.865,"Crime, Drama",800000,600000,93,Released
Frankenstein,1931,Passed,70 min,"Drama, Horror, Sci-Fi",7.8,Dr. Frankenstein dares to tamper with life and death by creating a human monster out of lifeless body parts.,91.0,James Whale,Colin Clive,Mae Clarke,Boris Karloff,John Boles,65341,,3035,7.47,1931-11-21,en,16.338,"Drama, Horror, Science Fiction",291000,12000000,70,Released
Roma,2018,R,135 min,Drama,7.7,A year in the life of a middle-class family's maid in Mexico City in the early 1970s.,96.0,Alfonso Cuarón,Yalitza Aparicio,Marina de Tavira,Diego Cortina Autrey,Carlos Peralta,140375,,426426,7.652,2018-11-21,es,13.747,Drama,15000000,1140769,135,Released
God's Own Country,2017,,104 min,"Drama, Romance",7.7,"Spring. Yorkshire. Young farmer Johnny Saxby numbs his daily frustrations with binge drinking and casual sex, until the arrival of a Romanian migrant worker for lambing season ignites an intense relationship that sets Johnny on a new path.",85.0,Francis Lee,Josh O'Connor,Alec Secareanu,Gemma Jones,Ian Hart,25198,"335,609",428493,7.8,2017-08-31,en,13.731,"Romance, Drama",0,2559939,105,Released
Deadpool 2,2018,R,119 min,"Action, Adventure, Comedy",7.7,"Foul-mouthed mutant mercenary Wade Wilson (a.k.a. Deadpool), brings together a team of fellow mutant rogues to protect a young boy with supernatural abilities from the brutal, time-traveling cyborg Cable.",66.0,David Leitch,Ryan Reynolds,Josh Brolin,Morena Baccarin,Julian Dennison,478586,"324,591,735",383498,7.493,2018-05-10,en,107.671,"Action, Comedy, Adventure",110000000,785896632,120,Released
Wind River,2017,R,107 min,"Crime, Drama, Mystery",7.7,A veteran hunter helps an FBI agent investigate the murder of a young woman on a Wyoming Native American reservation.,73.0,Taylor Sheridan,Kelsey Asbille,Jeremy Renner,Julia Jones,Teo Briones,205444,"33,800,859",395834,7.44,2017-08-03,en,36.218,"Crime, Mystery, Thriller, Western",11000000,44998252,107,Released
Get Out,2017,R,104 min,"Horror, Mystery, Thriller",7.7,"A young African-American visits his white girlfriend's parents for the weekend, where his simmering uneasiness about their reception of him eventually reaches a boiling point.",85.0,Jordan Peele,Daniel Kaluuya,Allison Williams,Bradley Whitford,Catherine Keener,492851,"176,040,665",419430,7.622,2017-02-24,en,57.449,"Mystery, Thriller, Horror",4500000,255407969,104,Released
Mission: Impossible - Fallout,2018,UA,147 min,"Action, Adventure, Thriller",7.7,"Ethan Hunt and his IMF team, along with some familiar allies, race against time after a mission gone wrong.",86.0,Christopher McQuarrie,Tom Cruise,Henry Cavill,Ving Rhames,Simon Pegg,291257,"220,159,104",353081,7.431,2018-07-13,en,45.854,"Action, Adventure",178000000,791658205,147,Released
En man som heter Ove,2015,PG-13,116 min,"Comedy, Drama, Romance",7.7,"Ove, an ill-tempered, isolated retiree who spends his days enforcing block association rules and visiting his wife's grave, has finally given up on life just as an unlikely friendship develops with his boisterous new neighbors.",70.0,Hannes Holm,Rolf Lassgård,Bahar Pars,Filip Berg,Ida Engvoll,47444,"3,358,518",348678,7.609,2015-12-25,sv,17.837,"Comedy, Drama",0,30692889,116,Released
What We Do in the Shadows,2014,R,86 min,"Comedy, Horror",7.7,"Viago, Deacon and Vladislav are vampires who are finding that modern life has them struggling with the mundane - like paying rent, keeping up with the chore wheel, trying to get into nightclubs and overcoming flatmate conflicts.",76.0,Jemaine Clement,Taika Waititi,Jemaine Clement,Taika Waititi,Cori Gonzalez-Macuer,157498,"3,333,000",246741,7.574,2014-06-19,en,16.65,"Comedy, Horror",1600000,6300000,86,Released
Omoide no Mânî,2014,U,103 min,"Animation, Drama, Family",7.7,"Due to 12 y.o. Anna's asthma, she's sent to stay with relatives of her guardian in the Japanese countryside. She likes to be alone, sketching. She befriends Marnie. Who is the mysterious, blonde Marnie.",72.0,James Simone,Hiromasa Yonebayashi,Sara Takatsuki,Kasumi Arimura,Nanako Matsushima,32798,"765,127",242828,7.948,2014-07-19,ja,27.491,"Animation, Drama, Family, Mystery",0,34949567,103,Released
The Theory of Everything,2014,U,123 min,"Biography, Drama, Romance",7.7,A look at the relationship between the famous physicist Stephen Hawking and his wife.,72.0,James Marsh,Eddie Redmayne,Felicity Jones,Tom Prior,Sophie Perry,404182,"35,893,537",266856,7.852,2014-11-26,en,19.719,"Drama, Romance",15000000,123726688,123,Released
Kingsman: The Secret Service,2015,A,129 min,"Action, Adventure, Comedy",7.7,"A spy organisation recruits a promising street kid into the agency's training program, while a global threat emerges from a twisted tech genius.",60.0,Matthew Vaughn,Colin Firth,Taron Egerton,Samuel L. Jackson,Michael Caine,590440,"128,261,724",207703,7.635,2015-01-24,en,74.722,"Crime, Comedy, Action, Adventure",81000000,414351546,129,Released
The Fault in Our Stars,2014,UA,126 min,"Drama, Romance",7.7,Two teenage cancer patients begin a life-affirming journey to visit a reclusive author in Amsterdam.,69.0,Josh Boone,Shailene Woodley,Ansel Elgort,Nat Wolff,Laura Dern,344312,"124,872,350",222935,7.596,2014-05-16,en,46.155,"Romance, Drama",14000000,307166834,133,Released
Me and Earl and the Dying Girl,2015,PG-13,105 min,"Comedy, Drama",7.7,"High schooler Greg, who spends most of his time making parodies of classic movies with his co-worker Earl, finds his outlook forever altered after befriending a classmate who has just been diagnosed with cancer.",74.0,Alfonso Gomez-Rejon,Thomas Mann,RJ Cyler,Olivia Cooke,Nick Offerman,123210,"6,743,776",308369,7.539,2015-06-12,en,19.157,"Drama, Comedy",0,0,105,Released
Birdman or (The Unexpected Virtue of Ignorance),2014,A,119 min,"Comedy, Drama",7.7,"A washed-up superhero actor attempts to revive his fading career by writing, directing, and starring in a Broadway production.",87.0,Alejandro G. Iñárritu,Michael Keaton,Zach Galifianakis,Edward Norton,Andrea Riseborough,580291,"42,340,598",194662,7.466,2014-10-17,en,44.664,"Drama, Comedy",18000000,103215094,120,Released
La vie d'Adèle,2013,A,180 min,"Drama, Romance",7.7,"Adèle's life is changed when she meets Emma, a young woman with blue hair, who will allow her to discover desire and to assert herself as a woman and as an adult. In front of others, Adèle grows, seeks herself, loses herself, and ultimately finds herself through love and loss.",89.0,Abdellatif Kechiche,Léa Seydoux,Adèle Exarchopoulos,Salim Kechiouche,Aurélien Recoing,138741,"2,199,675",152584,7.091,2013-10-09,fr,23.774,"Romance, Drama",4300000,19465835,180,Released
Kai po che!,2013,U,130 min,"Drama, Sport",7.7,Three friends growing up in India at the turn of the millennium set out to open a training academy to produce the country's next cricket stars.,40.0,Abhishek Kapoor,Amit Sadh,Sushant Singh Rajput,Rajkummar Rao,Amrita Puri,32628,"1,122,527",168245,6.992,2013-02-13,hi,8.702,Drama,0,0,126,Released
