Series_Title,Released_Year,Certificate,Runtime,Genre,IMDB_Rating,Overview,Meta_score,Director,Star1,Star2,Star3,Star4,No_of_Votes,Gross,tmdb_id,tmdb_vote_average,tmdb_release_date,tmdb_original_language,tmdb_popularity,tmdb_genres,tmdb_budget,tmdb_revenue,tmdb_runtime,tmdb_status
The Shawshank Redemption,1994,A,142 min,Drama,9.3,"Two imprisoned men bond over a number of years, finding solace and eventual redemption through acts of common decency.",80.0,Frank Darabont,Tim Robbins,Morgan Freeman,Bob Gunton,William Sadler,2343110,"28,341,469",278,8.707,1994-09-23,en,132.077,"Drama, Crime",25000000,28341469,142,Released
The Godfather,1972,A,175 min,"Crime, Drama",9.2,An organized crime dynasty's aging patriarch transfers control of his clandestine empire to his reluctant son.,100.0,Francis Ford Coppola,Marlon Brando,Al Pacino,James Caan,Diane Keaton,1620367,"134,966,411",238,8.7,1972-03-14,en,98.398,"Drama, Crime",6000000,245066411,175,Released
The Dark Knight,2008,UA,152 min,"Action, Crime, Drama",9.0,"When the menace known as the Joker wreaks havoc and chaos on the people of Gotham, Batman must accept one of the greatest psychological and physical tests of his ability to fight injustice.",84.0,Christopher Nolan,Christian Bale,Heath Ledger,Aaron Eckhart,Michael Caine,2303232,"534,858,444",155,8.516,2008-07-16,en,136.594,"Drama, Action, Crime, Thriller",185000000,1004558444,152,Released
The Godfather: Part II,1974,A,202 min,"Crime, Drama",9.0,"The early life and career of Vito Corleone in 1920s New York City is portrayed, while his son, Michael, expands and tightens his grip on the family crime syndicate.",90.0,Francis Ford Coppola,Al Pacino,Robert De Niro,Robert Duvall,Diane Keaton,1129952,"57,300,000",240,8.575,1974-12-20,en,89.555,"Drama, Crime",13000000,102600000,202,Released
12 Angry Men,1957,U,96 min,"Crime, Drama",9.0,A jury holdout attempts to prevent a miscarriage of justice by forcing his colleagues to reconsider the evidence.,96.0,Sidney Lumet,Henry Fonda,Lee J. Cobb,Martin Balsam,John Fiedler,689845,"4,360,000",389,8.546,1957-04-10,en,38.216,Drama,397751,4360000,97,Released
The Lord of the Rings: The Return of the King,2003,U,201 min,"Action, Adventure, Drama",8.9,Gandalf and Aragorn lead the World of Men against Sauron's army to draw his gaze from Frodo and Sam as they approach Mount Doom with the One Ring.,94.0,Peter Jackson,Elijah Wood,Viggo Mortensen,Ian McKellen,Orlando Bloom,1642758,"377,845,905",122,8.482,2003-12-17,en,192.24,"Adventure, Fantasy, Action",94000000,1118888979,201,Released
Pulp Fiction,1994,A,154 min,"Crime, Drama",8.9,"The lives of two mob hitmen, a boxer, a gangster and his wife, and a pair of diner bandits intertwine in four tales of violence and redemption.",94.0,Quentin Tarantino,John Travolta,Uma Thurman,Samuel L. Jackson,Bruce Willis,1826188,"107,928,762",680,8.488,1994-09-10,en,89.081,"Thriller, Crime",8500000,213928762,154,Released
Schindler's List,1993,A,195 min,"Biography, Drama, History",8.9,"In German-occupied Poland during World War II, industrialist Oskar Schindler gradually becomes concerned for his Jewish workforce after witnessing their persecution by the Nazis.",94.0,Steven Spielberg,Liam Neeson,Ralph Fiennes,Ben Kingsley,Caroline Goodall,1213505,"96,898,818",424,8.565,1993-12-15,en,86.27,"Drama, History, War",22000000,321365567,195,Released
Inception,2010,UA,148 min,"Action, Adventure, Sci-Fi",8.8,A thief who steals corporate secrets through the use of dream-sharing technology is given the inverse task of planting an idea into the mind of a C.E.O.,74.0,Christopher Nolan,Leonardo DiCaprio,Joseph Gordon-Levitt,Elliot Page,Ken Watanabe,2067042,"292,576,195",27205,8.369,2010-07-15,en,85.621,"Action, Science Fiction, Adventure",160000000,825532764,148,Released
Fight Club,1999,A,139 min,Drama,8.8,"An insomniac office worker and a devil-may-care soapmaker form an underground fight club that evolves into something much, much more.",66.0,David Fincher,Brad Pitt,Edward Norton,Meat Loaf,Zach Grenier,1854740,"37,030,102",550,8.439,1999-10-15,en,65.279,Drama,63000000,100853753,139,Released
The Lord of the Rings: The Fellowship of the Ring,2001,U,178 min,"Action, Adventure, Drama",8.8,A meek Hobbit from the Shire and eight companions set out on a journey to destroy the powerful One Ring and save Middle-earth from the Dark Lord Sauron.,92.0,Peter Jackson,Elijah Wood,Ian McKellen,Orlando Bloom,Sean Bean,1661481,"315,544,750",120,8.416,2001-12-18,en,173.564,"Adventure, Fantasy, Action",93000000,871368364,179,Released
Forrest Gump,1994,UA,142 min,"Drama, Romance",8.8,"The presidencies of Kennedy and Johnson, the events of Vietnam, Watergate and other historical events unfold through the perspective of an Alabama man with an IQ of 75, whose only desire is to be reunited with his childhood sweetheart.",82.0,Robert Zemeckis,Tom Hanks,Robin Wright,Gary Sinise,Sally Field,1809221,"330,252,182",13,8.473,1994-06-23,en,102.067,"Comedy, Drama, Romance",55000000,677387716,142,Released
"Il buono, il brutto, il cattivo",1966,A,161 min,Western,8.8,A bounty hunting scam joins two men in an uneasy alliance against a third in a race to find a fortune in gold buried in a remote cemetery.,90.0,Sergio Leone,Clint Eastwood,Eli Wallach,Lee Van Cleef,Aldo Giuffrè,688390,"6,100,000",429,8.462,1966-12-22,it,88.032,Western,1200000,38900000,161,Released
The Lord of the Rings: The Two Towers,2002,UA,179 min,"Action, Adventure, Drama",8.7,"While Frodo and Sam edge closer to Mordor with the help of the shifty Gollum, the divided fellowship makes a stand against Sauron's new ally, Saruman, and his hordes of Isengard.",87.0,Peter Jackson,Elijah Wood,Ian McKellen,Viggo Mortensen,Orlando Bloom,1485555,"342,551,365",121,8.399,2002-12-18,en,128.995,"Adventure, Fantasy, Action",79000000,926287400,179,Released
The Matrix,1999,A,136 min,"Action, Sci-Fi",8.7,"When a beautiful stranger leads computer hacker Neo to a forbidding underworld, he discovers the shocking truth--the life he knows is the elaborate deception of an evil cyber-intelligence.",73.0,Lana Wachowski,Lilly Wachowski,Keanu Reeves,Laurence Fishburne,Carrie-Anne Moss,1676426,"171,479,930",603,8.218,1999-03-31,en,67.389,"Action, Science Fiction",63000000,463517383,136,Released
Goodfellas,1990,A,146 min,"Biography, Crime, Drama",8.7,"The story of Henry Hill and his life in the mob, covering his relationship with his wife Karen Hill and his mob partners Jimmy Conway and Tommy DeVito in the Italian-American crime syndicate.",90.0,Martin Scorsese,Robert De Niro,Ray Liotta,Joe Pesci,Lorraine Bracco,1020727,"46,836,394",769,8.462,1990-09-12,en,53.61,"Drama, Crime",25000000,46800000,145,Released
Star Wars: Episode V - The Empire Strikes Back,1980,UA,124 min,"Action, Adventure, Fantasy",8.7,"After the Rebels are brutally overpowered by the Empire on the ice planet Hoth, Luke Skywalker begins Jedi training with Yoda, while his friends are pursued by Darth Vader and a bounty hunter named Boba Fett all over the galaxy.",82.0,Irvin Kershner,Mark Hamill,Harrison Ford,Carrie Fisher,Billy Dee Williams,1159315,"290,475,067",1891,8.392,1980-05-20,en,36.53,"Adventure, Action, Science Fiction",18000000,538400000,124,Released
One Flew Over the Cuckoo's Nest,1975,A,133 min,Drama,8.7,"A criminal pleads insanity and is admitted to a mental institution, where he rebels against the oppressive nurse and rallies up the scared patients.",83.0,Milos Forman,Jack Nicholson,Louise Fletcher,Michael Berryman,Peter Brocco,918088,"112,000,000",510,8.416,1975-11-19,en,39.75,Drama,3000000,108981275,133,Released
Hamilton,2020,PG-13,160 min,"Biography, Drama, History",8.6,"The real life of one of America's foremost founding fathers and first Secretary of the Treasury, Alexander Hamilton. Captured live on Broadway from the Richard Rodgers Theater with the original Broadway cast.",90.0,Thomas Kail,Lin-Manuel Miranda,Phillipa Soo,Leslie Odom Jr.,Renée Elise Goldsberry,55291,,556574,8.197,2020-07-03,en,16.124,"History, Drama",0,0,160,Released
Gisaengchung,2019,A,132 min,"Comedy, Drama, Thriller",8.6,Greed and class discrimination threaten the newly formed symbiotic relationship between the wealthy Park family and the destitute Kim clan.,96.0,Bong Joon Ho,Kang-ho Song,Lee Sun-kyun,Cho Yeo-jeong,Choi Woo-sik,552778,"53,367,844",496243,8.507,2019-05-30,ko,71.997,"Comedy, Thriller, Drama",11363000,257591776,133,Released
Soorarai Pottru,2024,U,153 min,Drama,8.6,"Nedumaaran Rajangam ""Maara"" sets out to make the common man fly and in the process takes on the world's most capital intensive industry and several enemies who stand in his way.",,Sudha Kongara,Suriya,Madhavan,Paresh Rawal,Aparna Balamurali,54995,,595228,0.0,2024-10-06,ta,29.204,"Drama, Action",0,0,149,Released
Interstellar,2014,UA,169 min,"Adventure, Drama, Sci-Fi",8.6,A team of explorers travel through a wormhole in space in an attempt to ensure humanity's survival.,74.0,Christopher Nolan,Matthew McConaughey,Anne Hathaway,Jessica Chastain,Mackenzie Foy,1512360,"188,020,017",157336,8.441,2014-11-05,en,134.733,"Adventure, Drama, Science Fiction",165000000,701729206,169,Released
Cidade de Deus,2002,A,130 min,"Crime, Drama",8.6,"In the slums of Rio, two kids' paths diverge as one struggles to become a photographer and the other a kingpin.",79.0,Fernando Meirelles,Kátia Lund,Alexandre Rodrigues,Leandro Firmino,Matheus Nachtergaele,699256,"7,563,397",598,8.425,2002-08-30,pt,52.687,"Drama, Crime",3300000,30641770,130,Released
Sen to Chihiro no kamikakushi,2001,U,125 min,"Animation, Adventure, Family",8.6,"During her family's move to the suburbs, a sullen 10-year-old girl wanders into a world ruled by gods, witches, and spirits, and where humans are changed into beasts.",96.0,Hayao Miyazaki,Daveigh Chase,Suzanne Pleshette,Miyu Irino,Rumi Hiiragi,651376,"10,055,859",129,8.537,2001-07-20,ja,91.291,"Animation, Family, Fantasy",19000000,274925095,125,Released
Saving Private Ryan,1998,R,169 min,"Drama, War",8.6,"Following the Normandy Landings, a group of U.S. soldiers go behind enemy lines to retrieve a paratrooper whose brothers have been killed in action.",91.0,Steven Spielberg,Tom Hanks,Matt Damon,Tom Sizemore,Edward Burns,1235804,"216,540,909",857,8.217,1998-07-24,en,56.473,"Drama, History, War",70000000,481840909,169,Released
The Green Mile,1999,A,189 min,"Crime, Drama, Fantasy",8.6,"The lives of guards on Death Row are affected by one of their charges: a black man accused of child murder and rape, yet who has a mysterious gift.",61.0,Frank Darabont,Tom Hanks,Michael Clarke Duncan,David Morse,Bonnie Hunt,1147794,"136,801,374",497,8.507,1999-12-10,en,62.258,"Fantasy, Drama, Crime",60000000,286801374,189,Released
La vita è bella,1997,U,116 min,"Comedy, Drama, Romance",8.6,"When an open-minded Jewish librarian and his son become victims of the Holocaust, he uses a perfect mixture of will, humor, and imagination to protect his son from the dangers around their camp.",59.0,Roberto Benigni,Roberto Benigni,Nicoletta Braschi,Giorgio Cantarini,Giustino Durano,623629,"57,598,247",637,8.448,1997-12-20,it,45.145,"Comedy, Drama",20000000,230098753,116,Released
Se7en,1995,A,127 min,"Crime, Drama, Mystery",8.6,"Two detectives, a rookie and a veteran, hunt a serial killer who uses the seven deadly sins as his motives.",65.0,David Fincher,Morgan Freeman,Brad Pitt,Kevin Spacey,Andrew Kevin Walker,1445096,"100,125,643",807,8.375,1995-09-22,en,62.516,"Crime, Mystery, Thriller",33000000,327311859,127,Released
The Silence of the Lambs,1991,A,118 min,"Crime, Drama, Thriller",8.6,"A young F.B.I. cadet must receive the help of an incarcerated and manipulative cannibal killer to help catch another serial killer, a madman who skins his victims.",85.0,Jonathan Demme,Jodie Foster,Anthony Hopkins,Lawrence A. Bonney,Kasi Lemmons,1270197,"130,742,922",274,8.349,1991-02-14,en,12.007,"Crime, Drama, Thriller",19000000,272742922,119,Released
Star Wars,1977,UA,121 min,"Action, Adventure, Fantasy",8.6,"Luke Skywalker joins forces with a Jedi Knight, a cocky pilot, a Wookiee and two droids to save the galaxy from the Empire's world-destroying battle station, while also attempting to rescue Princess Leia from the mysterious Darth Vader.",90.0,George Lucas,Mark Hamill,Harrison Ford,Carrie Fisher,Alec Guinness,1231473,"322,740,140",11,8.204,1977-05-25,en,75.994,"Adventure, Action, Science Fiction",11000000,775398007,121,Released
Seppuku,,,133 min,"Action, Drama, Mystery",8.6,"When a ronin requesting seppuku at a feudal lord's palace is told of the brutal suicide of another ronin who previously visited, he reveals how their pasts are intertwined - and in doing so challenges the clan's integrity.",85.0,Masaki Kobayashi,Tatsuya Nakadai,Akira Ishihama,Shima Iwashita,Tetsurô Tanba,42004,,1328550,0.0,,en,0.001,N/A,0,0,0,Released
Shichinin no samurai,1954,U,207 min,"Action, Adventure, Drama",8.6,A poor village under attack by bandits recruits seven unemployed samurai to help them defend themselves.,98.0,Akira Kurosawa,Toshirô Mifune,Takashi Shimura,Keiko Tsushima,Yukiko Shimazaki,315744,"269,061",346,8.5,1954-04-26,ja,32.622,"Action, Drama",2000000,2626918,207,Released
It's a Wonderful Life,1946,PG,130 min,"Drama, Family, Fantasy",8.6,An angel is sent from Heaven to help a desperately frustrated businessman by showing him what life would have been like if he had never existed.,89.0,Frank Capra,James Stewart,Donna Reed,Lionel Barrymore,Thomas Mitchell,405801,,1585,8.275,1946-12-20,en,53.361,"Drama, Family, Fantasy",3180000,9644124,130,Released
Joker,2019,A,122 min,"Crime, Drama, Thriller",8.5,"In Gotham City, mentally troubled comedian Arthur Fleck is disregarded and mistreated by society. He then embarks on a downward spiral of revolution and bloody crime. This path brings him face-to-face with his alter-ego: the Joker.",59.0,Todd Phillips,Joaquin Phoenix,Robert De Niro,Zazie Beetz,Frances Conroy,939252,"335,451,311",475557,8.154,2019-10-01,en,645.558,"Crime, Thriller, Drama",55000000,1078958629,122,Released
Whiplash,2014,A,106 min,"Drama, Music",8.5,A promising young drummer enrolls at a cut-throat music conservatory where his dreams of greatness are mentored by an instructor who will stop at nothing to realize a student's potential.,88.0,Damien Chazelle,Miles Teller,J.K. Simmons,Melissa Benoist,Paul Reiser,717585,"13,092,000",244786,8.382,2014-10-10,en,51.693,"Drama, Music",3300000,50307484,107,Released
The Intouchables,2011,UA,112 min,"Biography, Comedy, Drama",8.5,"After he becomes a quadriplegic from a paragliding accident, an aristocrat hires a young man from the projects to be his caregiver.",57.0,Olivier Nakache,Éric Toledano,François Cluzet,Omar Sy,Anne Le Ny,760360,"13,182,281",77338,8.278,2011-11-02,fr,66.376,"Drama, Comedy",13000000,426590315,113,Released
The Prestige,2006,U,130 min,"Drama, Mystery, Sci-Fi",8.5,"After a tragic accident, two stage magicians engage in a battle to create the ultimate illusion while sacrificing everything they have to outwit each other.",66.0,Christopher Nolan,Christian Bale,Hugh Jackman,Scarlett Johansson,Michael Caine,1190259,"53,089,891",1124,8.204,2006-10-17,en,43.904,"Drama, Mystery, Science Fiction",40000000,109676311,130,Released
The Departed,2006,A,151 min,"Crime, Drama, Thriller",8.5,An undercover cop and a mole in the police attempt to identify each other while infiltrating an Irish gang in South Boston.,85.0,Martin Scorsese,Leonardo DiCaprio,Matt Damon,Jack Nicholson,Mark Wahlberg,1189773,"132,384,315",1422,8.167,2006-10-04,en,34.668,"Drama, Thriller, Crime",90000000,291465000,151,Released
The Pianist,2002,R,150 min,"Biography, Drama, Music",8.5,A Polish Jewish musician struggles to survive the destruction of the Warsaw ghetto of World War II.,85.0,Roman Polanski,Adrien Brody,Thomas Kretschmann,Frank Finlay,Emilia Fox,729603,"32,572,577",423,8.382,2002-09-17,en,34.19,"Drama, War",35000000,120098945,150,Released
Gladiator,2000,UA,155 min,"Action, Adventure, Drama",8.5,A former Roman General sets out to exact vengeance against the corrupt emperor who murdered his family and sent him into slavery.,67.0,Ridley Scott,Russell Crowe,Joaquin Phoenix,Connie Nielsen,Oliver Reed,1341460,"187,705,427",98,8.217,2000-05-04,en,91.552,"Action, Drama, Adventure",103000000,465361176,155,Released
American History X,1998,R,119 min,Drama,8.5,A former neo-nazi skinhead tries to prevent his younger brother from going down the same wrong path that he did.,62.0,Tony Kaye,Edward Norton,Edward Furlong,Beverly D'Angelo,Jennifer Lien,1034705,"6,719,864",73,8.345,1998-07-01,en,28.085,Drama,20000000,23900000,119,Released
The Usual Suspects,1995,A,106 min,"Crime, Mystery, Thriller",8.5,"A sole survivor tells of the twisty events leading up to a horrific gun battle on a boat, which began when five criminals met at a seemingly random police lineup.",77.0,Bryan Singer,Kevin Spacey,Gabriel Byrne,Chazz Palminteri,Stephen Baldwin,991208,"23,341,568",629,8.184,1995-07-19,en,28.643,"Drama, Crime, Thriller",6000000,23300000,106,Released
Léon,1994,A,110 min,"Action, Crime, Drama",8.5,"Mathilda, a 12-year-old girl, is reluctantly taken in by Léon, a professional assassin, after her family is murdered. An unusual relationship forms as she becomes his protégée and learns the assassin's trade.",64.0,Luc Besson,Jean Reno,Gary Oldman,Natalie Portman,Danny Aiello,1035236,"19,501,238",101,8.3,1994-09-14,en,56.159,"Crime, Drama, Action",16000000,45284974,111,Released
The Lion King,1994,U,88 min,"Animation, Adventure, Drama",8.5,"Lion prince Simba and his father are targeted by his bitter uncle, who wants to ascend the throne himself.",88.0,Roger Allers,Rob Minkoff,Matthew Broderick,Jeremy Irons,James Earl Jones,942045,"422,783,777",8587,8.258,1994-06-24,en,98.65,"Family, Animation, Drama",45000000,763455561,89,Released
Terminator 2: Judgment Day,1991,U,137 min,"Action, Sci-Fi",8.5,"A cyborg, identical to the one who failed to kill Sarah Connor, must now protect her teenage son, John Connor, from a more advanced and powerful cyborg.",75.0,James Cameron,Arnold Schwarzenegger,Linda Hamilton,Edward Furlong,Robert Patrick,995506,"204,843,350",280,8.12,1991-07-03,en,57.287,"Action, Thriller, Science Fiction",102000000,520000000,137,Released
Nuovo Cinema Paradiso,1988,U,155 min,"Drama, Romance",8.5,A filmmaker recalls his childhood when falling in love with the pictures at the cinema of his home village and forms a deep friendship with the cinema's projectionist.,80.0,Giuseppe Tornatore,Philippe Noiret,Enzo Cannavale,Antonella Attili,Isa Danieli,230763,"11,990,401",11216,8.449,1988-11-17,it,23.482,"Drama, Romance",5000000,11990401,124,Released
Hotaru no haka,2005,U,89 min,"Animation, Drama, War",8.5,A young boy and his little sister struggle to survive in Japan during World War II.,94.0,Isao Takahata,Tsutomu Tatsumi,Ayano Shiraishi,Akemi Yamaguchi,Yoshiko Shinohara,235231,,76826,7.9,2005-11-01,ja,13.588,Drama,0,0,148,Released
Back to the Future,1985,U,116 min,"Adventure, Comedy, Sci-Fi",8.5,"Marty McFly, a 17-year-old high school student, is accidentally sent thirty years into the past in a time-traveling DeLorean invented by his close friend, the eccentric scientist Doc Brown.",87.0,Robert Zemeckis,Michael J. Fox,Christopher Lloyd,Lea Thompson,Crispin Glover,1058081,"210,609,762",105,8.318,1985-07-03,en,69.218,"Adventure, Comedy, Science Fiction",19000000,381109762,116,Released
Once Upon a Time in the West,1968,U,165 min,Western,8.5,A mysterious stranger with a harmonica joins forces with a notorious desperado to protect a beautiful widow from a ruthless assassin working for the railroad.,80.0,Sergio Leone,Henry Fonda,Charles Bronson,Claudia Cardinale,Jason Robards,302844,"5,321,508",335,8.287,1968-12-21,it,47.177,"Drama, Western",5000000,5380118,166,Released
Psycho,1960,A,109 min,"Horror, Mystery, Thriller",8.5,"A Phoenix secretary embezzles $40,000 from her employer's client, goes on the run, and checks into a remote motel run by a young man under the domination of his mother.",97.0,Alfred Hitchcock,Anthony Perkins,Janet Leigh,Vera Miles,John Gavin,604211,"32,000,000",539,8.431,1960-06-22,en,42.732,"Horror, Thriller, Mystery",806947,32000000,109,Released
Casablanca,1943,U,102 min,"Drama, Romance, War",8.5,A cynical expatriate American cafe owner struggles to decide whether or not to help his former lover and her fugitive husband escape the Nazis in French Morocco.,100.0,Michael Curtiz,Humphrey Bogart,Ingrid Bergman,Paul Henreid,Claude Rains,522093,"1,024,560",289,8.16,1943-01-15,en,24.937,"Drama, Romance",878000,10462500,102,Released
Modern Times,1936,G,87 min,"Comedy, Drama, Family",8.5,The Tramp struggles to live in modern industrial society with the help of a young homeless woman.,96.0,Charles Chaplin,Charles Chaplin,Paulette Goddard,Henry Bergman,Tiny Sandford,217881,"163,245",3082,8.294,1936-02-05,en,20.973,"Comedy, Drama, Romance",1500000,1800000,87,Released
City Lights,1931,G,87 min,"Comedy, Drama, Romance",8.5,"With the aid of a wealthy erratic tippler, a dewy-eyed tramp who has fallen in love with a sightless flower girl accumulates money to be able to help her medically.",99.0,Charles Chaplin,Charles Chaplin,Virginia Cherrill,Florence Lee,Harry Myers,167839,"19,181",901,8.3,1931-02-06,en,17.482,"Comedy, Drama, Romance",1500000,4250000,87,Released
Capharnaüm,2018,A,126 min,Drama,8.4,"While serving a five-year sentence for a violent crime, a 12-year-old boy sues his parents for neglect.",75.0,Nadine Labaki,Zain Al Rafeea,Yordanos Shiferaw,Boluwatife Treasure Bankole,Kawsar Al Haddad,62635,"1,661,096",517814,8.152,2018-09-20,ar,23.011,Drama,4000000,64978931,126,Released
Ayla: The Daughter of War,2017,,125 min,"Biography, Drama, History",8.4,"In 1950, amid-st the ravages of the Korean War, Sergeant Süleyman stumbles upon a half-frozen little girl, with no parents and no help in sight. Frantic, scared and on the verge of death, ...                See full summary »",,Can Ulkay,Erdem Can,Çetin Tekindor,Ismail Hacioglu,Kyung-jin Lee,34112,,472454,8.1,2017-10-27,tr,8.842,"Drama, War, History",4200000,21107423,124,Released
Vikram Vedha,2017,UA,147 min,"Action, Crime, Drama",8.4,"Vikram, a no-nonsense police officer, accompanied by Simon, his partner, is on the hunt to capture Vedha, a smuggler and a murderer. Vedha tries to change Vikram's life, which leads to a conflict.",,Gayatri,Pushkar,Madhavan,Vijay Sethupathi,Shraddha Srinath,28401,,432139,7.37,2017-07-21,ta,7.772,"Action, Thriller, Crime, Adventure",0,0,147,Released
Kimi no na wa.,2016,U,106 min,"Animation, Drama, Fantasy",8.4,"Two strangers find themselves linked in a bizarre way. When a connection forms, will distance be the only thing to keep them apart?",79.0,Makoto Shinkai,Ryûnosuke Kamiki,Mone Kamishiraishi,Ryô Narita,Aoi Yûki,194838,"5,017,246",372058,8.487,2016-08-26,ja,73.114,"Animation, Romance, Drama",0,358000000,106,Released
Dangal,2016,U,161 min,"Action, Biography, Drama",8.4,Former wrestler Mahavir Singh Phogat and his two wrestler daughters struggle towards glory at the Commonwealth Games in the face of societal oppression.,,Nitesh Tiwari,Aamir Khan,Sakshi Tanwar,Fatima Sana Shaikh,Sanya Malhotra,156479,"12,391,761",360814,7.906,2016-12-21,hi,14.261,"Drama, Family, Comedy, Action",10400000,311000000,161,Released
Spider-Man: Into the Spider-Verse,2018,U,117 min,"Animation, Action, Adventure",8.4,"Teen Miles Morales becomes the Spider-Man of his universe, and must join with five spider-powered individuals from other dimensions to stop a threat for all realities.",87.0,Bob Persichetti,Peter Ramsey,Rodney Rothman,Shameik Moore,Jake Johnson,375110,"190,241,310",324857,8.4,2018-12-06,en,67.078,"Animation, Action, Adventure, Science Fiction",90000000,384298736,117,Released
Avengers: Endgame,2019,UA,181 min,"Action, Adventure, Drama",8.4,"After the devastating events of Avengers: Infinity War (2018), the universe is in ruins. With the help of remaining allies, the Avengers assemble once more in order to reverse Thanos' actions and restore balance to the universe.",78.0,Anthony Russo,Joe Russo,Robert Downey Jr.,Chris Evans,Mark Ruffalo,809955,"858,373,000",299534,8.251,2019-04-24,en,108.427,"Adventure, Science Fiction, Action",356000000,2799439100,181,Released
Avengers: Infinity War,2018,UA,149 min,"Action, Adventure, Sci-Fi",8.4,The Avengers and their allies must be willing to sacrifice all in an attempt to defeat the powerful Thanos before his blitz of devastation and ruin puts an end to the universe.,68.0,Anthony Russo,Joe Russo,Robert Downey Jr.,Chris Hemsworth,Mark Ruffalo,834477,"678,815,482",299536,8.246,2018-04-25,en,190.746,"Adventure, Action, Science Fiction",300000000,2052415039,149,Released
Coco,2017,U,105 min,"Animation, Adventure, Family",8.4,"Aspiring musician Miguel, confronted with his family's ancestral ban on music, enters the Land of the Dead to find his great-great-grandfather, a legendary singer.",81.0,Lee Unkrich,Adrian Molina,Anthony Gonzalez,Gael García Bernal,Benjamin Bratt,384171,"209,726,015",354912,8.213,2017-10-27,en,194.781,"Family, Animation, Music, Adventure",175000000,807816196,105,Released
Django Unchained,2012,A,165 min,"Drama, Western",8.4,"With the help of a German bounty hunter, a freed slave sets out to rescue his wife from a brutal Mississippi plantation owner.",81.0,Quentin Tarantino,Jamie Foxx,Christoph Waltz,Leonardo DiCaprio,Kerry Washington,1357682,"162,805,434",68718,8.181,2012-12-25,en,63.287,"Drama, Western",100000000,425368238,165,Released
The Dark Knight Rises,2012,UA,164 min,"Action, Adventure",8.4,"Eight years after the Joker's reign of anarchy, Batman, with the help of the enigmatic Catwoman, is forced from his exile to save Gotham City from the brutal guerrilla terrorist Bane.",78.0,Christopher Nolan,Christian Bale,Tom Hardy,Anne Hathaway,Gary Oldman,1516346,"448,139,099",49026,7.78,2012-07-17,en,64.449,"Action, Crime, Drama, Thriller",250000000,1081041287,165,Released
